manual_headline,claude_headline,gemini_headline,openai_headline
NO_HEADLINE,Pittsburgh Water pauses Four Mile Run and three other flood mitigation projects due to funding shortfalls.,Pittsburgh Water pauses four flood mitigation projects to prioritize funding for mandated system-wide repairs.,City Council discusses pause and funding challenges for Four Mile Run flood mitigation projects
NO_HEADLINE,Council introduces resolution allowing Team Pittsburgh to live-stream hockey games at Marmaduke Park at no cost to the city.,Council introduces legislation to allow live-streaming of dek hockey games at Marmaduke Park.,Council authorizes agreement for free live-streaming of dek hockey games at Marmaduke Park
NO_HEADLINE,Council considers sewage plan revision for Hermitage Street development at no cost to city.,City's official sewage plan to be updated for new Hermitage Street development.,Council adopts sewage plan revision for 7415 Hermitage Street at no cost to the city
NO_HEADLINE,"Council transfers $10,000 from salaries to City Clerk's office for professional services.","Legislation to transfer $10,000 from Council salaries to the City Clerk was not introduced.","Councilwoman Kail-Smith proposes $10,000 budget transfer to City Clerk for professional services"
NO_HEADLINE,"Council approves payment of $6,158 to New Pittsburgh Courier for legal advertisements related to city property title actions.","City to pay New Pittsburgh Courier $6,158.30 for legal advertisements.","Council approves payment of $6,158.30 to New Pittsburgh Courier for legal ads"
NO_HEADLINE,"Council refers resolution to authorize $750,000 annual contracts with five vendors for special events services.",Council proposes eleven contracts with five vendors for on-call special events services.,"City Council approves 11 on-call service agreements with five vendors for special events up to $750,000 annually"
NO_HEADLINE,Council authorizes temporary construction easements on city property for Smithfield Street repair project.,City seeks temporary construction easements for the Smithfield Street repair project.,Council authorizes actions to record temporary construction easements for Smithfield Street repairs at no cost to the City
Riverlife Barge Venue to Dock at Allegheny Landing Park,Council refers resolution allowing Riverlife to use city dock for public river barge programming to committee.,Riverlife proposes connecting a public programming barge to the Allegheny Landing Dock.,Council approves agreement allowing Riverlife barge access from Allegheny Landing Dock at no cost to city
Bill to Allow Pollinator Gardens and Natural Landscapes Introduced,Council introduces ordinance allowing residents to plant and maintain native gardens and natural landscapes on their property.,Proposed ordinance would allow residents to create native plant gardens.,Council introduces ordinance allowing residents to plant and maintain managed natural landscapes
Challenged Historic Designation for Former Gay Bar to Receive Public Hearing,Council designates Donny's Place on Herron Avenue as historic structure despite owner opposition.,Council designates Donny's Place historic over owner and commission objections.,Council designates Donny’s Place at 1226 Herron Avenue as a Historic Structure despite owner opposition
NO_HEADLINE,Council refers resolution to loan city-owned Stephen Foster statue to Museum of Contemporary Art at no cost.,City proposes loaning the Stephen Foster statue to the Museum of Contemporary Art.,Council approves loan of Stephen Foster statue to Museum of Contemporary Art at no cost
NO_HEADLINE,Council cancels sale of 136 Bodkin Street property and orders refund of hand money.,City Council rescinds sale of 136 Bodkin Street.,Council repeals 2022 property sale of 136 Bodkin Street and orders refund of deposit
NO_HEADLINE,City Council approves sale of 14 vacant lots in 12th Ward to Larimer Consensus Group to settle court cases.,"Council approves sale of 14 city-owned lots in Larimer for $26,677.",City Council approves sale of 12th Ward properties to Larimer Consensus Group to settle court cases
Untested Sexual Assault Kits to Be Processed,"Council approves $37,000 grant to help police investigate old sexual assault cases and improve interview rooms.","$37,000 grant approved for old sexual assault case investigations.","Council approves $37,000 grant agreement to support police investigations and training"
NO_HEADLINE,"Council approves application for $250,000 state grant to fix Emerald View Trail with city matching funds.","City to apply for $250,000 state grant for Emerald View Trail rehabilitation.",Council approves grant application and city funding for Emerald View Trail rehabilitation project
NO_HEADLINE,Council passes ordinance clarifying rules for posting residential parking permit signs.,New ordinance clarifies which streets and at what times residential parking permits will be enforced.,Council approves clearer rules for residential parking permit signage
NO_HEADLINE,Council expands residential permit parking program to more South Side Flats streets.,More streets in the South Side Flats added to residential permit parking zone.,Council approves expansion of Residential Permit Parking Area KK in South Side Flats
NO_HEADLINE,Council approves sewage plan revision for Walnut McKee Apartments development at 296 McKee Place.,Council approves sewer connection for new Walnut McKee Apartments.,City Council approves sewage plan revision for 296 McKee Place at no cost to the City
NO_HEADLINE,Council approves sewage plan revision for South Side townhome development at no cost to the City.,Council approves sewer plan for new Josephine Street Townhomes.,City Council approves sewage plan revision for 215 South 21st Street development at no cost to the City
NO_HEADLINE,"Council approves $8,200 deal to let ALCOSAN build underground tunnels through nine city properties.",City grants ALCOSAN underground land access for a major sewer project.,"City Council approves easements for ALCOSAN tunnels on nine city-owned properties for $8,200"
NO_HEADLINE,"Council schedules meeting on police, EMS and fire equipment after ambulance breaks down responding to emergency call.",Council schedules hearing on aging public safety vehicles.,"Council schedules special meeting to address EMS, fire, and police fleet issues"
'Tiny Lots' Approved After Spirited Debate,Council holds public hearing on bill to reduce minimum lot sizes for residential development.,Council hears conflicting public testimony on a bill to reduce minimum lot sizes for homes.,Council holds public hearing and advances bill to reduce minimum lot sizes in residential zoning districts
NO_HEADLINE,"Council holds resolution to sell city-owned property on Itin Street for $3,755.",Council holds proposed sale of Itin Street property for one week.,City Council holds resolution for sale of 23rd Ward property for one week
NO_HEADLINE,"Council holds resolution to transfer $33,292 for employee tuition reimbursement for six weeks.","$33,292 transfer for council staff tuition reimbursement is held for six weeks.","City Council votes to hold $33,292 budget transfer for tuition reimbursement for six weeks"
"$40,000 Contract with Law Firm for “Immigration Matters” Authorized","Council approves $40,000 contract with law firm for immigration legal services.","City approves $40,000 contract for immigration legal services.","Council approves $40,000 contract for immigration legal services with Fragomen firm"
NO_HEADLINE,Council holds ordinance to increase paid sick leave accrual rates and maximum hours for public hearing.,Legislation to increase paid sick days for workers advances to a public hearing.,Council holds Bill 1736 on paid sick leave accrual rates for public hearing
NO_HEADLINE,Council approves agreement for University of Pittsburgh to pay for extra trash pickup in Oakland during student move-in and move-out periods.,University of Pittsburgh to fund up to 15 additional city trash collections in Oakland.,Council approves amended agreement with University of Pittsburgh for supplemental waste pickup in Oakland at no cost to the city
NO_HEADLINE,Council approves agreement for six new bus shelters in Hazelwood at no cost to the city.,Six new bus shelters will be built in Hazelwood at no cost to the city.,City Council approves agreement with Almono LP for six new bus shelters in Hazelwood at no cost to city
NO_HEADLINE,Council approves agreement allowing Team Pittsburgh to live-stream hockey games at Marmaduke Park at no cost to the city.,Dek hockey games at Marmaduke Park will be live-streamed at no cost to the city.,City Council approves agreement to live-stream dek hockey games at Marmaduke Park at no cost to the City
NO_HEADLINE,Council approves transferring city property at 219 Reifert Street to Pittsburgh Land Bank for $1.,The Pittsburgh Land Bank will acquire a city property at 219 Reifert Street.,Council approves Pittsburgh Land Bank acquisition of city property at 219 Reifert Street
