segment,matched_agenda_segment
"Good morning and welcome to the regular meeting of City Council for Tuesday, April 15 2025. The President and President Pro Tem of Pittsburgh City Council are both unable to attend this morning's meeting. Therefore, under Rule 5. 1 in the Rules of Council, the Clerk shall first take a roll call and then the members shall elect a temporary President Pro Tem to preside over the meeting.",-1
"Can a Clerk please take the roll? Mr Sharland Here. Mr Coghill Here. Ms Gross Here Mr Mosley Here Mrs Kale-Smith Here. Mrs Strasburger Here Mrs Warwick, Here Mr Wilson, Here Mr LaVelle. President, Five members present.",-1
The floor is now open to Council to elect their temporary President Pro Tem. Motion to nominate Councilwoman Strasburger as the temporary Pro Tem. Second Councilperson Strasburger will now take over as President Pro Tem.,-1
"Thank you, Good morning and welcome to the regular meeting of the City Council, Tuesday, April 15 2025.",-1
"Please rise for the Pledge of Allegiance and remain standing for a moment of silence. I pledge allegiance to the flag of the United States of America and to the Republic for which it stands: one nation under God, indivisible with liberty and justice for all. I pledge allegiance to the flag of the United States of America and to the Republic for which it stands: one nation under God, indivisible, with liberty and justice for all. I pledge allegiance to the flag of the United States of America and to the Republic for which it stands: one nation under God, indivisible, with liberty and justice for all. You may be seated. You may be seated.",-1
Our next order of business is to amend the agenda. Our next order of business is to amend the agenda. Is there a motion to amend the agenda? So moved Second. All those in favor: Aye.,-1
buzzing Councilman Mosley. Councilman Mosley presents.,-1
"be it further resolved that the Council of the City of Pittsburgh does hereby declare Friday, May 2 2025 to be Bessie Lee Harris Day in the City of Pittsburgh. Is there a motion to approve? So moved. Second. All in favor: Aye. Those opposed: vote no. Aye, Aye. Proclamation is approved.",3
"There being no further speakers, we will now move on to the presentation of papers For the first committee of the day.",-1
"Councilperson Sharland Chair of Human Resources. Good morning, Madam President. I was going to ask. That's what I was going to ask.",-1
"Councilperson Sharland presents Bill Number 1730. Thank you, Bill Number 1730. bill number 1739, Resolution 1739 ordinance amending the Pittsburgh Code of Ordinances, Title V- Traffic. Article VII, Parking, Chapter 549, residential parking permit program to clarify the regulations for posting of signage. And.",6
"Bill Number 1739 resolution amending resolution 98 of 2017 providing for the implementation of a residential permit parking program, area KK in the Southside Flats to expand the streets pursuant to Pittsburgh City Code, Chapter 549. Councilman Coghill, Chair of Public Safety and Wellness. Can I waive Rule 8 or motion to waive Rule 8 on those? Motion to waive Rule 8 on On both bills, On both bills. Second, Is there a second? All those in favor of waiving the Rules of Counsel Aye, Aye Rules will be waived so that these Bill 1738 and 1739 appears on tomorrow's Standing Committee's agenda. Thank you, Thank you. Thank you.",6
"Thank you very much, Councilman Coghill. No new papers, Madam Chair.",-1
"Thank you very much, Councilwoman Gross. Councilman Mosley. for Councilwoman Gross: No, I'm sorry. yes, I'm sorry. Can you hear me? We can hear you now. Oh, I apologize. No papers, Madam President.",-1
"Thank you very much, Councilman Mosley. Chair of Intergovernmental and Educational Affairs Committee. Thank you, Madam President. Agenda Achieved Agenda, Agenda 3 of 2. Mississauga, at the National Tourism Summit in 2009, was recognized as a State of the Land in 2015. The Board and the Council were recognized on August 19, 2014.",-1
"Councilman Coghill- Yes, Councilman Coghill- Yes. Councilman Coghill, chair of intergovernmental and educational affairs committee. thank you, madam president.",-1
"councilman Mosley presents bill number 1727 resolution authorizing the Pittsburgh land bank to acquire all the city's right, title and interests, if any, in into the publicly owned property in the 30th Ward of the city of Pittsburgh, designated in the deed registry office of Allegheny County as block 33 K, lot 128, 219 Reifert Street. council, district number three, at no cost to the city.",7
"and councilwoman Kale Smith, chair of recreation, youth and senior services committee. councilman Mosley. for a councilwoman Kale Smith: none new papers. madam president, thank you very much.",-1
and my committee finance and law. can we have council person Warwick for my committee?,-1
"council person Strasburger presents bill number 1728 resolution authorizing the mayor and the city solicitor to enter into a professional services agreement with Fragman del Rey, Burnson and lowly LLP in an amount not to exceed forty thousand dollars over one year for professional services in connection with immigration matters you.",8
"next we have councilwoman Barb Warwick, chair of public works and infrastructure committee. thank you, councilwoman Warwick.",-1
"presents bill number 1729 resolution authorizing the mayor and the director of the department of mobility and infrastructure, on behalf of the city of Pittsburgh, to enter into an ownership and maintenance agreement with Albano LP for six bus shelters to be constructed along Second Avenue and Blair Street to correct building and maintenance of the Elevable käyt pani consists of a window, architecture scrapers, an Avenue and Blair Street in a Hazelwood neighborhood at no cost to the city.",9
"and we'll move on to councilman Wilson, chair of land use and economic development committee, because person Warwick, no new papers. thank you very much.",-1
"and for council president Lavelle, we have four appointments and we will need a motion to interview or approve once they are read.",-1
"council president Lavelle presents bill number 1730 resolution appointing and Marie Allison as a member of the LGBTQIA plus Commission, term to expire April 1st 2029.",10
"bill 1731 resolution appointing Elliott Williams as a member of the shade tree Commission, term to expire April 1st 2029. and.",11
"bill number 1732 resolution appointing Brian Murray to the Pittsburgh HIV AIDS Commission per title one, administrative commission. and.",12
"bill number 1732 resolution appointing Brian Murray to the Pittsburgh HIV AIDS commission per title one, administrative article nine boards, commissions and authorities. chapter 179 C: establishment of the Pittsburgh HIV and AIDS Commission- 179 co2 one in 179 co2 two of the Pittsburgh City Code of Ordinances.",12
"bill number 1733 resolution appointing Clarice Jordan to the Pittsburgh HIV AIDS Commission. per title one: administrative article 9: boards, commissions and authorities. chapter 179 C- establishment of Pittsburgh HIV AIDS Commission per title one: administrative. article 9: boards, commissions and authorities. chapter 179 C- establishment of Pittsburgh HIV AIDS Commission per title one: administrative article 9 boards. commission 179 C 0 2 1 and 179 C 0 2 2 of the Pittsburgh City Code of Ordinances. commission 179 C 0 2 1 and 179 C 0 2 2 of the Pittsburgh City Code of Ordinances. we need a motion to interview or approve. second: all those in favor, all those in favor of approving the motion to approve our nominees for the various commissions, please say aye, aye, aye, aye. we will now move on to two communications: bill number 1734, communication from Jake Paul act, director of the Office of Management and Budget, submitting the City Council attached status update from the grants office for the week ended April 11th 2025.",13
"and bill number 1735, communication from Felicity Williams, deputy chief of staff, submitting the equal opportunity review Commission quarterly report for the period ending March 31st 2025. we need a motion to read, receive and file. so move second: all those in favor. aye, motion passes. and now we have one piece of sponsored legislation from council president Lavelle, in bill number 1736, ordinance amending the Pittsburgh code, title 6, conduct, article 1, regulated rights and actions, chapter 626, paid sick days Act, section 6 to 6: 0, 3, accrual of sixth time so as to change the rate at which employees can impute, accumulate paid sick leave hours and increase the maximum total amount of paid sick leave hours that can be accumulated. thank you very much.",16
that now moves us on to unfinished business.,-1
"we have two appointments: bill number two, three, two, four, nine, eighty six resolution reappointing Afton Giles as a member of the clean Pittsburgh Commission, term to expire September 1st 2028.",17
"and bill number 2025. 1668 resolution reappointing Janet Evans as a member of the Housing Authority of the City of Pittsburgh Board of Directors, term to expire December 31st 2029. we need a motion to approve. motion to approve. second, second, second discussion. all those in favor, please indicate by saying aye, motion passes. is there any other unfinished business before council?",18
"seeing none, we will now move on to reports of committees for final action.",-1
"we have the Finance and Law Committee. councilwoman Kale Smith, can you please submit my legislation for final action. thank you, thank you. council person Strassburger.",-1
presents bill number 1724. reported a Committee on Finance and Law for April 9th 2025 with an affirmative recommendation.,19
"bill 1687 resolution authorizing the issuance of a warrant in favor of the County of Allegheny in an amount not to exceed thirteen thousand six hundred and forty seven dollars over one year, in full and final settlement of a claim for damage to the glycol line sidewalk heating system, the allegheny county courthouse by domey traffic division during sign placement on the forbes avenue sidewalk area of the courthouse on december 20th, december 3rd 2024. you have heard the reading and the title of the bill. is there any discussion on the bill? seeing none, the bill is now ready for final action. all in favor of the passage of the bill will vote aye when their name is called. those opposed will vote no. will the clerk please call the roll mr charlotte, aye. mr coghill- aye. ms gross: aye. mr mosley: aye. mrs kail smith. mrs warwick: aye, mr strasburger, chair: aye. seven eyes, zero nose. the bill, having received the legally required number of votes, is passed finally.",20
"council person barbara warwick. presents the committee on public works and infrastructure. thank you, madam president. director of the Office of Management and Budget to apply for a grant from the Pennsylvania Department of Economic Development's multimodal transportation fund for the Penn Avenue lighting project. the grant proposal includes an ask of four hundred sixty one thousand eight hundred and fifty six dollars for this stated purpose, to accept the grant, reduce the grant amount and authorize necessary expenditures.",22
"and bill 1690 resolution amending resolution 133 of 2024, entitled: resolution authorizing the mayor and the director of the Department of Public Works to enter into an agreement or agreements or the use of existing agreements between the city of Pittsburgh and Paschak plus MTR, for the professional design services for the Fort Pitt Park phase one improvements at a cost not to exceed three hundred thousand dollars, by increasing the total cost by one hundred fifteen thousand one hundred and seventy dollars for a new total city cost not to exceed four hundred fifteen thousand one hundred hundred and fifty six dollars for the construction of the park phase one. cost not to exceed four hundred and seventy dollars for the construction of the park phase one. you have heard the reading in the title of the bill. is there any discussion on the bill? bills are now ready for final action. all in favor of the passage of the bill will vote aye when their name is called. those opposed will vote no. will the clerk please call the roll? mr Sharland? aye, mr Coghill. hi miss gross. mr Mosley. hi mrs Kale Smith. mrs Warwick, hi mrs Strassberger. president, aye seven, ayes, zero, noes. the bill, having received the legally required number of votes, is passed finally.",23
"now move on to councilman Kihari Mosley. committee on intergovernmental and educational affairs. Thank You, madam president.",-1
"councilman Mosley presents bill number 1726, reported a committee on intergovernmental and educational affairs for April 9th 2025, with an affirmative recommendation.",24
bill 1681 resolution authorizing the issuance of a warrant payable in favor of Pennsylvania Municipal League for one year subscription in an amount not to exceed fifty two thousand nine hundred sixty two dollars and twenty four cent.,25
bill 1682 resolution providing for the issuance of a warrant in favor of the Pennsylvania Public Utilities Commission in the amount of seventy two thousand five hundred dollars for delinquent debts owed by the city of Pittsburgh for 811 damaged prevention. calls.,26
"bill 1683 resolution appealing resolution 366 of 2019, effective June 14th 2019, authorizing the urban redevelopment authority of Pittsburgh to acquire all the city's right, title and interests, if any, and into the publicly owned property in a 15th Ward city of Pittsburgh designated in the deed registry office of Allegheny County as block 56 B, slide 56 345, council district number five, at no cost to the city.",27
"bill 1684 resolution approving execution of a contract for disposition by sale of land between the URA of Pittsburgh and the Pittsburgh land bank for the cellar block 10 J, lots 259 and 260, fifth Ward city of Pittsburgh, Aaron Street, council district number six, at no cost to the city.",28
"bill 1685 resolution approving execution of a contract for disposition by sale of land between the URA of Pittsburgh and Island Avenue Holdings LLC for the sale of block 21 D, lot 42 a in the 27th Ward city of Pittsburgh, Island Avenue, council district number two, at no cost to the city.",29
"bill 1686 resolution approving execution of a contract for disposition by sale of land between the URA of Pittsburgh and the Pittsburgh land bank for the cellar block 83 a. for the cellar block 83 a, the cellar block 83 at number six i lady starring city on Pittsburgh. look unique salary fee if n ms that will lateral and will be suppliedtrade pays by by all lease to the active parent and prices lily after we e five anchors and overhead wires upon city-owned property collectively, the DLC assets to manage vegetation on a certain property in the vicinity of the DLC assets and to perform landscaping in the vicinity of the DLC assets at no cost to the city. You have heard the reading and the title of the bills. Is there any discussion on the bills? Madam President, Yes, I have an amendment that I'm hoping I see being passed around. We have it in front of us. Councilwoman, you are muted. If you're speaking, we cannot hear you. Yeah, my phone is cutting out. I apologize. This is the amendment we have in front of us. It's just a request by PWSA. It's a request by the PWSA clarifying who's responsible for landscaping at the pump house in Highland Park. So I'm going to motion to amend. Do we have a second Second? All those in favor of the amendment before us please indicate by saying aye. Aye, Bill 1723 is amended. Is there any further discussion from members? The bills are now ready. Seeing none. the bills are now ready for final action. All in favor of the passable. Aye, The passage of the bills will vote aye when their name is called. Those opposed will vote no. Will the clerk please call the roll Mr Sharland. Aye, Mr Coghill. Aye, Ms Gross. Aye, Mr Mosley. Aye, Mrs Kale-Smith. Aye, Mrs Warwick. Aye, Mrs Strasburger-President: Aye, Seven ayes, zero, noes, The bills having received the legally required number of votes are passed. finally, Any discussion.",30
"So, as the council members have said, we will now move on to the motion and resolution.",-1
We will now move on to the motion and resolution.,-1
"We will now move on to the motion and resolution. So anything from members? Yes, Council Member Warwick. Yes, Council Member Warwick. I just wanted to make a quick comment, That's OK. Yeah, So I just you know, with regard to the attack on Governor Shapiro's House and on his family over the weekend: Obviously horrific attack and terrifying. I can't imagine how stressful that is for the governor and his wife and their kids. But more than that, I just wanted to note the fact that our president referred to the attacker as just some whack job, as if this was some random situation. and it wasn't and it didn't have anything to do with the fact that this is a Jewish governor and that the attack was on the first night of Passover. to sort of wave it off as just some random situation, while at the same time, you know, actively disappearing from the picture Legal residents in the United States to foreign countries under the claim that they are terrorists, with no evidence whatsoever, totally illegal and totally unconstitutional. It's just, it's very scary, And I just wanted to mention it because I know that you know we're all here at city council, we're going about our business, we're doing you know we're going through an election, et cetera, et cetera. you know what I mean And I just wanted to mention it because I know that you know we're all here at We're going through an election, et cetera, et cetera, and everyone is doing that. right, Everyone is just going about their day and going to work and doing the things that we have to do, but people are feeling it and people and it's frightening and I just want to acknowledge that, acknowledge that that is, you know, that sentiment here in Pittsburgh and all across the country, that you know that we are aware here at City Council and that we appreciate the way that everyone is feeling, and certainly you know the way that our Jewish community members are feeling, given this attack on Sunday. So that's all from me. Thank you. Thank you, Council Member. Is there anything further from members? Yes, Council Member, Strassberger, Council. thank you, Councilman Wilson, followed by Councilwoman Kale-Smith, Thank you. If I may, I'd like to register aye votes for the votes that I missed. So noted, Thank you. Thank you, Councilwoman Kale-Smith. Thank you, Thank you. I think this is just, I might say, half a bell on this, a lot. but there's just one thing that's interesting, which is obviously participation- and having a conversation about this is really packed with- is not relying on Generally Support all the time, But we again, I guess, just for the. I'm just wondering if we can. Council Member Warren, Was there a school day that we didn't get an existing? No, not, we didn't. people help and trying to make sure that, and there's people here locally. I mean, I know that on the national level there's a lot going on and I leave that to our congresswoman. I know that she's, you know, doing what she can on that level. but on this level, in the city of Pittsburgh, there's people missing, there's people going missing. there's things that are happening in the city of Pittsburgh on a daily basis that needs addressed by this council and by this administration, because otherwise we're focusing on things we weren't elected to do. but we can do both, but our focus should be predominantly on what's happening in the city of Pittsburgh. that's what we're elected to do and for me, I really I see kids missing all the time in the city of Pittsburgh. every week there's somebody going that you see a post that somebody has gone missing and to try to find that person. and, honestly, there's a lot to be said about what's happening in the homes of these, of our kids, and I think the more we just ignore this and just act like this is normal, the the worse, it's becoming, not better, and I think that we need to address what's happening here in Pittsburgh in terms of our young people leaving homes, missing, homes going missing. there's just a lot. I mean, it's just so much. it's it's depressing, it really is. it's depressing- of what's happening, you know, and in our neighborhoods and each and every day and in our, the homes of kids across the city of Pittsburgh, and I wish we would do more partnering with, you know, DHS and CYF and others to get resources into and and and even our, our rec centers. they should have those resources available where kids are not just in schools but places where kids can get them after school hours or a place where they can reach, you know, resources more comfortably, and I just wish we would do more with that. and I know council on work and I are talking about a couple things with schools and and doing some partnerships in the evenings and other times, but I think generally across the city of Pittsburgh it needs to be done and I'm I know in Sheridan we have there's a lot of youth crime in the community in that area- 15, 16- There's a lot for kids to do and I tell people this all the time: if having something to do was Meant that there would be safety and kids would be safe, Homewood and Sheridan would be some of the safest neighborhoods because they have some of the best Resources. and Sheridan, they have the Jasmine- I read they have this Langley's supposed to be a community-based school Which is supposed to have programs available. They have the library, they have parks, They have people doing like hope for tomorrow and the boxing program at Langley. I know there's a lot of programs in homeward because I used to partner with them and different things. But the problem is is that we set an expectation That an absence is something to do, is is it's okay to commit a crime, And what we ought to be doing is setting the bar a little bit higher for our kids, expecting a lot more for them and Trying to lead them in a better direction. And I just feel like, yes, there should be some more things for people to do. and yes, I'm eager for the Stevens school building to open. You know it has not opened and I do feel like it has been intentionally not open, delayed because it's needs so much work and And there's a. I could say a lot to that and I will say a lot. the conversation continues. I'll say a lot publicly every week, But what I'll say now is there's a lot of projects delayed in our district that would help kids and would do more for kids, But that's still not the overall answer. The answer is yes, give them some things, But let's also remember that we've got to set the bar high for our kids and teach them a little better like they do. in short, to your city, where it's. there's almost nothing for the kids to do down there except for Park in a ball field, But yet it has the highest, some of the highest, homeownership in the city of Pittsburgh, low crime, the kids Succeeding and doing well, and I think it's because they set the bar so high, so I just was. it's when the community embraces everybody. I think it's it's coming together that we need to do a little bit all over the country, all over the city of Pittsburgh. Thank you, Thanks, councilwoman. anything further from members. I think I saw council person Charlene first, followed by council and Mosley. All right, Yeah, thank you. I would like to call for a motion for a.",-1
