sentence,classification
"The land bank and the URA, and if there are community groups, would work through the land bank, They request us to put properties that they want in their inventory that they know are tax delinquent.",i
"We expose them to a treasurer sale, We take them and then we transfer them to them.",i
"But there's also individual buyers that would apply and we would take those as well, And they could either come to the sale and bid on them or buy them once we take them into our hands.",i
"Okay, and I wanted to clarify one thing, Councilman Wilson- and I think I have this right, but you too, I think I have this right, but you too, I think I have this right, but you too correct me if I'm wrong- Objectors can spark an auction if they object, correct?",i
"Yep, Okay, Once they spark that auction, if that objector goes and put, well, first of all, they have to put their hand money down.",i
"If they go to that auction and they do not get the winning bid, then they get their money back, correct, Okay, because I've done that right.",i
"So that's no harm, no foul there, Right, As far as objectors go, Right, It's the people that we are dealing with.",i
"through the City of Pittsburgh and our process, I feel like- And again it really comes down to this- The place is rotting before, after they put their hand money down.",i
"It you know and I understand your, I understand where you're at.",i
"I do, I understand your position, I really do.",i
"So it just needs to be a bigger, broader conversation.",i
And this did happen.,i
I know we've refunded.,i
"you said once, but I'd like to call it Peter.",i
"come on up here, McDevitt, if I can.",i
"Madam Chair, He has some history, I think, or I don't know if once, but twice, you said once this, somebody was refunded, And I'm not going to keep your hair forever.",i
"And Kevin, I don't know if anybody else has anything for you.",i
We can call you back up if they do.,i
I just like being part of the table.,i
"Okay, good deal, good deal.",i
"Well, I was going to maybe occupy your seat with Sean, but go ahead, Peter, please.",i
"Hi, Peter McDevitt, City Council Budget Director.",i
So something that jumped out at me is talking about how this would be setting a new precedent.,i
"Maybe my understanding of the word precedent is different, but we have done this at least twice in the last three years.",i
So council has initiated legislation to rescind the sale and the hand money is to be refunded.,i
Do you have the amounts of that hand money?,i
I don't have the amounts of it.,i
"Okay, all right, that's fine.",i
"It was at the end of 2022 when Reverend Burgess sponsored legislation and then, 18 months ago, Council President Lavelle sponsored legislation to rescind the sale and to refund the hand money.",i
So that's at least twice within the last three years.,i
So it's not a new thing.,i
"So the fair- possibly the administration or anybody you, Director, I guess- is that it would set precedents and open us up to a legal challenge.",i
"Glad you're here, Kevin, But if we have done it in the past, Then it's not unprecedented.",i
"It's not precedents, right?",i
"Well, sorry, I don't think.",i
"appreciate Peter bringing up legislation, but I don't think we've had a chance to review the legislation and understand the sale that it related to- and it is likely not an apples to apples comparison- Previous legislation that's been put in front of me, as prior examples have not been apples to apples comparisons under this administration.",i
"What I've seen are examples of, like Director Gula said, where either the city is at fault and unable to complete the sale or there is some sort of objection or dispute, but it's not the individual applicant who is applied who is then backing out once we're ready to complete a sale.",i
Fair enough.,i
There's no way that you can confirm that's the case.,i
I do.,i
"Right, okay, fair enough.",i
fair enough.,i
"Yeah, right, so Okay, I guess I'm going to.",i
I don't know what other members are going to do.,i
I've had this conversation with really other members other than a couple brief.,i
"you know notes and again, it's more the principle for me.",i
So I'm willing to bite the bullet and pay the four grand back.,i
We do have a million dollars.,i
We don't want to make precedents of this.,i
"We don't have that many structures where people can come back to us for millions of dollars, right, I mean, we only have a million dollars, Right, We only have a couple hundred structures.",i
"So at worst, if there's five others out there that say, hey, I wanted my money back, you know, so you know how much could it cost us in the end.",i
But ultimately we need to do some interior.,i
"you know, reorganization, I think more than anything here.",i
But I appreciate what you do.,i
I appreciate your stance on this.,i
I love you protecting our money like I really do.,i
I want you to know I respect that.,i
"okay, So okay, but that's it for me, madam, Madam chair, so thank you very much And thank you for being here.",i
"Thank you, And I know Council Member Warwick had her hand up first and then Councilwoman.",i
"oh no, no, you were just asking Gotcha.",i
"Councilwoman Kale-Smith, Just briefly.",i
I initially had a lot of concern because I thought we never did this.,i
I asked if we never did this before And I'm finding out now that we did it just twice in the past few months.,i
But I talked to somebody else and it's been seven times over the past few years and some of it has been initiated by your department and some by city council.,i
So now I feel a little bit more comfortable with moving forward.,i
"That's it for me, thank you.",i
Thank you.,i
Any further discussion Seeing none.,i
"all those in favor of Bill 1634, please indicate by saying aye, Aye, Aye.",i
Opposed abstentions: Abstain.,i
I'm gonna abstain as well.,i
Any abstentions?,i
Affirmative recommendation That moves us on to new papers.,b
"Great job, guys.",i
"Bill 17: I'm sorry we are gonna take a little diversion from the regularly scheduled program and move over to Public Safety and Wellness Committee, At the request of our attendees today chaired by Councilman Coghill.",i
"Bill 1703: Bill 1703: Resolution authorizing the mayor, the director of the Office of Management and Budget and the director of the Department of Public Safety to enter into an agreement or agreements with the County of Allegheny for the purpose of receiving grant funds from the 2023 National Sexual Assault Kit Initiative Grant and the amount not to exceed 37,000 to support overtime for PBP detectives for the investigation of old sexual assault cases, the purchasing of materials to properly furnish assault like prost irradiation abuse.",b
Tommy Moh andEPcium Vic Deients.,i
We again return to Public Safety and Wellness Committee's transportation documentation.,i
"In summary, Quinn truly, trabajo en Catuac con porú.",i
"questions about: I just wanted to make sure you came up and you know address if any other members had had anything, but it seems pretty self-explanatory.",i
"thirty seven thousand dollars, unless you want to explain it.",i
"yeah, it's just, we're seeking reimbursement.",i
Allegheny County Medical Examiner's Office actually obtained the grant and we are a sub awardee.,i
we did work for them on.,i
the dissident is an extension of the grant that they got in 2019.,i
"we did work for them on an overtime basis some of it, so they thought that we should receive reimbursement for it.",i
"so when they got the extension, they put in for a sub-awardee for us to receive, you know, no more than thirty six thousand dollars for overtime and then a thousand dollars for us to furnish a soft interview room.",i
so we're just looking for reimbursement that work that we're going to do anyway.,i
"understood, thanks, commander.",i
"Thank You, councilmember Charlin.",i
"yeah, thank you for being here.",i
I just understand this.,i
"I'm mm-hmm very supportive of any time we're getting grants for anything, but we are paying for work that we've already done.",i
or is this is a reimbursement for work that we've already done?,i
"no, well, we've done some of the work already.",i
"this is work to be done, yet we have identified the kids that we have in our property room that are untested.",i
most of that work was done with on-duty personnel.,i
"okay, reports were printed and pulled to give to the coordinator's office.",i
coordinator of this sake.,i
grant for the county.,i
that took some overtime hours.,i
we have marked those as reimbursed.,i
"have not sought reimbursement yet, but those were overtime hours that were already spent the the next part of the process is when they ask for the kids to be sent to the crime lab, we pull them, write reports, transport them.",i
that's where the bulk of the work is going to come in and then any follow-up investigations that follow.,i
"and just out of curiosity, what is a?",i
what is a soft interview?,i
"around right now we have interview rooms that are basically for very cold and sterile, consists of a desk and a chair.",i
"those are recorded rooms, not not very conducive for victim interviews.",i
"gotcha, we take them into conference room sometimes.",i
other times take them into these sterile rooms.,i
so in the short term was more like a gathering to have contact with the.,i
"So a softer room with a couch, some soft furnishings make it a little more easy for them to relax and tell their story, as opposed to a sterile environment.",i
"Sure, that makes sense.",i
"All right, thank you very much, Thank you.",i
any further questions?,i
"And I apologize, I didn't quite catch if you said your name and your- I did not.",i
"I'm sorry, Laurie McCartney, I'm the commander of Major Crimes, Thank you, thank you, just for the record.",i
thank you.,i
Any further discussion?,i
Seeing none?,i
"all those in favor of Bill 1703, please indicate by saying aye, Aye, Aye.",i
Affirmative recommendation.,i
thank you very much.,i
"Thank you, I appreciate it.",i
have a good day.,i
That moves us back up to our Finance and Law Committee and New Papers.,b
"Bill 1709: Bill 1709 resolution authorizing the issuance of a warrant in favor of Angelina Prior and her attorneys, Contos, Menjin, Killian and Hassan, for a single payment of 1,000.",b
"00 in a total of 3,000.",i
00 in 2020.,i
"a total of 3,000.",i
00 in 2020.,i
"All those in favor of Bill 1709, please indicate by saying aye, Aye, Aye.",i
Affirmative recommendation.,i
"Bill 1710: Bill 1710: Aye, Aye, Aye, Aye, Aye, Aye, Aye, Aye, Aye, Aye, Aye, Aye, Aye, Aye, Aye, Aye, Aye, Aye, Aye.",b
"Bill 1710 resolution authorizing the issuance of a warrant in favor of Gladys Sanchez in an amount not to exceed 8,301.",i
"36 over one year in full and final settlement of a claim for damage to her vehicle from an accident with a city police vehicle on December 17, 2024.",i
There a motion.,i
Motion to approve.,i
Second Discussion Seeing none.,i
"All those in favor of Bill 1710, please indicate by saying aye, Aye, Aye.",i
Affirmative recommendation.,i
"Bill 1711 Resolution authorizing the execution of a quick claim deed conveying all of the city's right, title and interests in and to the city-owned properties located in the 12th Ward of the City and designated in the Deed Registry Office of Allegheny County as Block and Lot 124N282, 283, 288, 290, 291, 292, 293, 124P96, 125B, 128, 129, 130, 131, 132, 133, 134, 134, 134, 134, 134, 134, 134, 134, 134, 134, 134, 134, 134, 134, 134, 134, 134, 134, 134, 134, 134, 134, 134, 134, 134, 134, 134, 134, 134, 134, 134, 134, 134, 134, 134, 134, 134, 134, 134, 13, 134, 134, 134, 134, 134, 134, 134, 134, 134, 134, 134.",b
So moved.,i
"Can I get a second, Oh?",i
"second Discussion, Seeing none.",i
"all those in favor of invoices please indicate by saying aye, Aye, Aye.",i
Affirmative recommendation.,i
That moves us on to P cards.,b
Is there a motion on P cards So moved?,i
Second Discussion: There were no notable comments from our assistant budget director on P cards.,i
"All those in favor of P cards please indicate by saying aye, Aye.",i
Affirmative recommendation.,i
P cards are approved.,i
"That moves us to Public Works and Infrastructure Committee, chaired by Council Member Warwick.",b
Bill 1712 resolution authorizing the mayor and the director of the Office of Management and Budget and the director of the Department of Mobility and Infrastructure to apply for the P cards.,b
Bill 1712 resolution authorizing the mayor and the director of the Office of Management and Budget and the director of the Office of Management and Budget and the director of Management and Infrastructure to apply for grant funding from the Pennsylvania Department of Conservation and Natural Resources Community Conservation Partnership Program to provide funding for the rehabilitation of Emerald View Trail project.,i
"The grant proposal includes an ask of 250,000 with a match of 250,844.",i
"42 from the City of Pittsburgh's capital budget, for a total project cost of 500,844.",i
42 for this stated purpose.,i
Upto the proposed plan was reached and approved by the Council for king structure in Pike County is a transit security union with the ability to review and interoperability attraction.,i
"To apply for the plan, it is not requiring changes in fundsutatic or grants- is legally redundant.",i
"have 300,000 in the 2024 capital budget.",i
that's for design.,i
"this 250,000, the grant that we're going after, is for the construction portion of the project, so that would be about a 500,000 and then we might have to put in additional ask in the 2025 capital or 2026 budget for the rest of the construction of that project.",i
I'm just and you've had.,i
I just want to be clear.,i
you've had meetings with the.,i
"there's a committee, the parks committee, for the Emery View Parks trail committee.",i
"you've had meetings with them, but have you had meetings with the general public with outside of that committee?",i
that group?,i
"we have no, I believe, can do that.",i
"yeah, I want you to do that, because every time we do a project, somebody's saying that's not the project that's most important.",i
"or somebody saying who had who, who made these decisions and it people don't attend meetings if they're not part of a committee, but yet they still care about the project.",i
"I'm not saying that's not the case, but I'm saying that's the case.",i
I'm saying that's what we're doing and we're doing it in a way that's not going to be a bad thing.,i
So I think we should be.,i
"I think we need to do better at meeting with the residents and getting out there and talking with them about a lot of the projects we're doing, and this is one of them.",i
"but one of the most important projects for that community is the Shaler Park renovations for the Eileen McCoy Park on Shaler, and I did- we did things for the council.",i
"we did just put forward a 500,000 project to help them with the Eileen McCoy project and we've been working with the Eileen McCoy and the City of Shaler Park on this project for a long time and we've been talking to the City of Shaler Park on that and we've been talking to the members of the City of Shaler Park on that and they've been saying they want to have that park renovated, so if we could do a project.",i
"I know that's very important to the community, but I think I'd like to hear from the community which is their most important priorities.",i
"So- and I know they're different departments, different things, but at the same time, I want to prioritize the public, the things with I want to engage them.",i
I want them to have an opportunity.,i
"Listen, I get frustrated sometimes when it comes be experts in public safety who help direct that.",i
"i think you should give them some feedback, but i don't know they should have every comp.",i
"they should control every comment or every project, but when it comes to things like their playgrounds and parks and things like that, i think we should be try to do a little bit more engagement in those areas.",i
but i do appreciate that they at least try to get a committee together.,i
"they have the feedback online that you can give, but sometimes people aren't familiar with using the online source.",i
you know resources.,i
"so, thank you.",i
i want to thank you for the work that you've done across our district.,i
"thank you, you've been great.",i
that's it.,i
"thank you, council member warwick, did you have a question?",i
"yeah, thanks, so that that just you know your comments from reminded me one thing, and i know that we've talked about it, but i really think that, going forward, we need to kind of solidify process wise is i would say.",i
"over the past few years, there has definitely been a shift, at least in my experience right in my district.",i
"right, there has been a major shift in the amount of engagement between the city and the community, which is great, like it's, it's wonderful, like the neighborhood services team is so nice to have people there.",i
"however, right when- and this is something i've experienced right is it's like when the city is so accessible, like in community, right there you do get the things like: well, i wasn't at the meeting, yeah, and i didn't know about that meeting, even though there were so many meetings.",i
"so it's, it's almost like we're in a, in sort of like it's like a mesh between the before and after.",i
"and i think that now we really need a solidified where we are saying on, on and- and i know it would be different depending on the size of the project, right, but where we are making abundantly clear up front.",i
"you know, it'd be nice to just have a standard template right, based on project size, but like, this is the project and we are going to have X number of meetings.",i
the first meeting is gonna be input.,i
"you know, whatever it is right, like just hypothetically, like the first meeting is gonna be input on design.",i
what would you like to see right?,i
"the next meeting is gonna be: this is the but making it clear, like this is the design that we paid for and this is it.",i
"and now we're like just showing it to you and then this right to, so that it's very clear for folks what our process is.",i
"because I've noticed and you know, and- and it's no fault of the public, right, because they don't understand- and our workings.",i
"but like, where there's confusion, where it's like, for example, we're at a stage where we've gotten our permits and we're going to bid, and then they're like, well, could, but could we like make a- you know what I mean- like we'd like to see like a different window or a door, and it's like to make that change would mean like go back to the pre-permitting.",i
so it's like to really make it clear from the outset what the engagement process is going to look like.,i
"and you don't I mean and so that, so that then when folk I mean, we do our best to let people know.",i
"but if we could say up front: this is, these are all the things that you can expect.",i
"you know that there's a lot of things that we can expect and we can expect in terms of engagement and then at the very least, then when someone comes, you know, at the tail end and says, wait a minute, I was there, at least we can say okay.",i
"well, actually, you know these are all the meetings that we had and I know that's on the engage page, but I don't know just if there's a way to kind of formalize that process depending on project size.",i
"thanks, thank you.",i
any further discussion?,i
seeing none.,i
all those in favor of bill 1712?,i
please indicate by saying aye.,i
affirmative recommendation bill 1713.,i
bill 1713 resolution authorizing the mayor and the director of the Department of Public Works to enter into an agreement and or amendments with the University of Pittsburgh for the purpose of providing supplemental waste operations in the Oakland neighborhood at no cost to the city.,b
second second discussion: it was that this is the request of the department.,i
"okay, great.",i
all those in favor of a one-week hold: please indicate by saying aye.,i
"aye, bill be held for one week.",i
that moves us on to land use and economic development committee chaired by councilman Wilson.,b
supplemental papers.,i
bill 1738: ordinance amending a Pittsburgh code of ordinance.,b
amendment of traffic in the direction of the one sized meva park building parking.,i
tragically charges all those in favor seven mainbeno information.,i
asking any further questions?,i
is there something?,i
"I'm sorry, was the applicant going to be the item talking about all of their services?",i
"that committee, yesatem, that summit was the one.",i
the recommendation is to closed the after meeting.,i
why we had 3 to 0 discussion by millers was the right number.,i
the current record was 2.,i
"America's mostiuous parkinguche of buildings during fiscal year has been za month following workers management have wares, property, WH, car injured or ASL Tahoe.",i
he's the.,i
So it's your committee Councilman.,i
We do have some people here in person and these are the next two bills.,i
"They're ones that also Angela Martinez is available online for, so well covered.",i
"Okay, Let me see here.",i
So I missed that.,i
Are we waiting for someone to come to the table?,i
"Nope, you can ask your questions.",i
"We're ready to go, All right.",i
"so for Bill 1738, I want to thank the sponsor.",i
"I know that he's worked hard on this And I just wanted to ask about future districts that could be created, and specifically there's one on the north side that you know we've been discussing with Domi and the parking authority and if I could get some clarity on whether or not this would affect that district.",i
So I'm going to go ahead and ask that question.,i
"Yeah, Rylan Seifert, Curbside Program Manager with Domi Councilman, this is going to be used in very narrow circumstances.",i
"For context, Domi only took over the RPP program in the beginning of 2022, so this is the first time that we're actually here to do a minor expansion of an RPP zone And, as we've managed your RPP program over the past few years, we've noticed a few of these little tweaks that need to be made to the code language.",i
"So installing limited amounts of RPP signage in non-residential areas is something that there's already precedent for in a few different neighborhoods, a few different streets, for that context makes sense.",i
"Also in hybrid RPP areas, which is something that the code allows for.",i
that we haven't implemented any of yet.,i
So it's really just to give us that opportunity.,i
"That's not something that I expect us to do on a wide arranging basis, really on a block by block, case by case basis, And I don't see how this would have any impact to the kind of parking enhancement district conversations that we've been having.",i
"Okay, great, Yeah, I'm happy that we're using that.",i
"Okay, So the hybrid option: I know that we included that when we worked together, Ryland, in the past on the bill that I put forward and this council voted for.",i
"So good to see this coming to fruition on the south side And so, in terms of this, wouldn't affect anything.",i
I just want to be clear that this is under a section 549-09- posting signs indicating restrictions- enforcement.,i
"So the line where it says it talks about signs, it's in bold and the text: signs may only be posted in regulations enforced in non-residential zoning districts.",i
"So is this, is this just reinforcing the code that was already written, that we wrote together years ago, Or is this new language that only?",i
it just doesn't look like it's specific to.,i
"I mean, it's under B, so it is specific to these.",i
It is mentioned.,i
these other areas are mentioned on the south side.,i
"I just want to make sure that this doesn't change, Okay, So I'm just going to go ahead and get back to that.",i
"Okay, Okay, Okay, Okay, Okay, Okay, Okay, Okay, Okay, Okay, Okay, Okay, Okay, Okay, Okay, Okay.",i
Thank you for that.,i
I have layers in this new license form And this version of the CH of fighting agency for some reasons.,i
Many colleagues say that there are timeãün area where there is this.,i
you know it's like before we had hybrid.,i
"well, this would be the first hybrid, but you know there was some different signage there that exists that doesn't exist anywhere else, And so that's just one example that comes to mind.",i
"Yeah, Good, We would not be adjusting any other signage retroactively in existing RPP zones.",i
"Okay, All right.",i
"Well, thank you for your time And I don't have any further questions.",i
"Thanks, Thank you, Council Member Sharlin.",i
"Yeah, So thank you guys for being here, Just to make sure everybody's aware of what all has gone on here.",i
This is related to a development that's in the south side that we have been working to try to get from.,i
"Actually, the project was entitled in 20.",i
"Before I even mentioned I was a staffer- Entitled, was sold to someone else, was titled again, was The residents appealed the entitlement to the appellate courts?",i
"This is a compromise that we found between the constituents, the developers and the city being a tri-party, And we're going to have to make a tri-party lawsuit there, And this is the step that we need in order to get the residents on board with building this project.",i
"that is truly just an underutilized alleyway that during the pandemic, people were doing peel-outs and car shows unauthorized and some really dangerous stuff happening there.",i
But this is the step that we need.,i
I'm very thankful that the development group was willing to stick themselves out here and commit to doing this for so long.,i
"I think a lot of other people with less deep pockets would have walked away, But we've met with this group literally every Friday for almost a year now to try to find a way to get a compromise.",i
We've had a standing meeting.,i
