sentence,classification
"I'm sorry, I'm sorry, I'll find.",i
"Thank you, thank you.",i
"I just wanted to clarify, I guess, really, what their concern is: that we will have a legal problem if we rescind the money- correct?",i
I don't think it's a- And we don't have one now by striking it.,i
"That's not a legal, it's not a question for anybody in the legal department.",i
"But if we- If we decide to refund the money, then that's your concern as setting precedents, and then maybe that needs a legal opinion.",i
"there, I guess The concern is not legal in nature, though there may be a legal question worth exploring if that's a path we're going to go down.",i
"The concern that we've tried to highlight here is one of financial management and responsible financial management, And you know, Council Member, to your point, we're trying to act in a way that is fiscally responsible, with sort of not just the city's budget in mind, but also the 3TB trust fund that Director Gula's mentioning responsible management of that.",i
"So that's where the concerns are at- is a financial matter, not necessarily a legal matter at this time, But it could become one.",i
But it could become one.,i
I think I need to ask the law department this.,i
"So, if you don't mind, Madam Chair, could we maybe hold until the law department can come in, So we cannot hold this any longer, And I think there's probably someone in the chambers here who can explain why, or maybe those joining us at the table already- as to why we're up against the clock, But we really only have until next Tuesday.",i
"No, I understand until next week, but can we just hold it until the end of the meeting?",i
is what I'm asking?,i
"I see, Until the law department comes.",i
"Hold until the end of the meeting, Yeah, because then you can take the police, get them out of here and then get the law department in here.",i
Does that sound fair?,i
I think we have.,i
I don't see anybody.,i
"She was here, but I don't see anyone.",i
We're joined by the law department today.,i
"Oh, you're with the law department.",i
"I'm sorry, You can come to the table if you don't mind.",i
We tag each other out.,i
"man, I apologize, I didn't know You're with the law department.",i
How are you?,i
I'm well.,i
"thank you, Kevin Frater.",i
I'm an assistant city solicitor.,i
"I'm standing in for Krisha Kubiak, the city solicitor.",i
So what can I help you with?,i
What's your question?,i
"So I'm wondering: if we do this now, will there be any legal ramifications down the road Or any consequences?",i
legally?,i
"Well, Because we've never done this before, right To my knowledge, we have not done it before.",i
"There would be certain legal ramifications that could occur, including members of the public being able to challenge the action, Could incur court costs, could incur delays on things And, as was already said by Director Gula, this would set a precedent that could cause significant damage to the, The, The The current land bank situation, which is in good standing.",i
"So that at this point, without doing a deep dive into it, I would ask Jack Miller, who is the head of our real estate department at the law department.",i
"He may be able to give a better written opinion than I could on the matter, because he's much more familiar with the land bank issues.",i
"Can I say just say thank God for Marty Griffin making comments about our flag needing replaced, Because, as we're in the middle of the meeting, in walks the guys with the flags to replace them.",i
"So Thanks, Marty Griffin.",i
"Sorry I apologize, But you're going to watch these guys climb out the window to replace the flags, Anyway.",i
so I'm just trying to figure out what I'm doing here.,i
"I want to make sure we're doing whatever's legally responsible and ethically responsible here, And I just don't know enough about this particular situation.",i
"I hear what you're saying, I hear what everybody else is saying And I know Councilman Calgo has a heart of gold.",i
I tell him there's somebody who is homeless that needed a job and he offered him a roofing job.,i
"So I mean, he's just And he's constantly taking care of people, And I think I just want to make sure that whatever we're doing here is legally responsible.",i
"So I can abstain today, unless others want to get a legal opinion.",i
Would you think a legal opinion would be helpful in this?,i
That's up to you.,i
I don't get to make the determinations or the decisions.,i
Do you think it would be helpful?,i
He'll know.,i
I think that Jack would be able to give you a much more in-depth dive than I can.,i
Are you OK with that.,i
I'm fine with that.,i
"We can get it by Tuesday, Before Tuesday, And we'll have the knowledge about then which way.",i
"OK, So you can move it for today.",i
"Whoops, I'll abstain.",i
You can move it forward.,i
"If the legal opinion comes back negative in a way that we can't move forward, then we can kill it next week, Table it next week, Thank you.",i
"Thank you, Councilwoman.",i
We have Councilman Wilson.,i
"Thank you, Chair.",i
"Before our legal office leaves the table, I just wanted to ask- I wasn't planning on asking about this, but the land bank came up several times in the comments- And how does this put the land bank at risk?",i
Or are you actually trying to say the finance department?,i
"So the land bank trust fund is what I was discussing, And the land bank trust fund, The three taxing bodies Trust fund.",i
"I think you mean three taxing bodies, I'm sorry.",i
"Yes, The three taxing bodies trust fund.",i
That's in there And that's where the money.,i
"Thank you, No problem, Yeah, OK, Yeah, That's all good.",i
I just wanted to clear that up.,i
I like it.,i
"Nice, Thanks, Thanks, I just wanted to- Yeah, Yeah, Yeah, Yeah, Yeah.",i
"Just recognize that I appreciate the work of the Director Gula and the finance department And everyone that works there Out of your hands is what the situation is that's before us, Which is just the length of time that it would take to.",i
"I mean, maybe some of it's in your hands.",i
"I'm not trying to pick through that now, But Yeah, Yeah, Just in general, the length of time that the buyer would have to wait from the time they see the property, The time they could actually get in and start repairing the property, is, I mean, that's the issue In this case, I believe, The years that go by until they can get in and repair the roof.",i
"And that's also more reason to Why people Yeah, Yeah, Yeah, Yeah, Yeah.",i
"That's why people choose Without words right now, but it's, it's not eminent domain, It's the Conservatorship.",i
That's why people choose conservatorship sometimes to get in sooner and report back to the judge on what the progress is.,i
"And I'm also hearing From some of my colleagues- Just, You know- celebrating the finance department, which is great.",i
"I mean I, I love more tax revenue, But we also have to be mindful.",i
I know that this is a constant topic.,i
"And I'm also hearing from my colleagues- you know, just, You know- celebrating the finance department, which is great.",i
"I mean I, I love more tax revenue, But we also have to be mindful.",i
I know that this is a constant topic.,i
"I know that this is a constant topic, But we also have to be mindful- I know that this is a constant topic here, But we also have to be mindful- I know that this is a constant topic here- At the table of, You know, selling to speculators or Predatory, You know future landlords or You know anyone that would, You know wholesale or speculator.",i
"So we, you know currently there's no.",i
"I mean, I'm happy to Understand if I'm incorrect here, but my understanding is we just have to sell to, To the, You know, to the highest bidder.",i
"It would be, It'll be.",i
"I don't know, It's just, It's just not that we could do that.",i
"I mean, we we incorrect here, but my understanding is we just have to sell to the, to the, you know, to the highest bidder when we sell at the city and if there's not a you know like a responsible buyer process, is that, is that correct, director?",i
"that's, that's not entirely true.",i
"first of all, someone has to be vetted in order to become a purchaser, which means we look, they fill out an application and we have to make sure that that either company or individual does not have any open pli violations and they do not owe any municipal liens or open tax dollars to the city.",i
"second, then that property is actually vetted for the use that that person actually enters in on their application.",i
"so the planning department- there's a, there's a property committee that looks at the application and then they look at the application and then they look at the application and then they look at the application and then they look at the application and then they look at that and says, okay, is, is this parcel what they want to use it for?",i
apt for the end use after where it's located and does it.,i
"you know, as long as it fits in with, maybe, what the community plan is and they're approved to buy it, then yes, we can definitely sell to anybody.",i
we we have to.,i
"yes, we have to.",i
it's sort of part of the check with the community before you sell property.,i
"yeah, oh, there's community plans.",i
"i'm not aware, i'm not aware of that.",i
i have a couple pieces of property that we had on item street that you know.,i
"i guess i wasn't aware you, you emailed the community group or how does that happen?",i
"there's, there's actually a working group of individuals that will reach out to community groups.",i
"they reach out to zoning and city planning and then they either approve the property for sale for what the end use is, based on the application.",i
i'm sorry.,i
you said there's a committee.,i
"yep, oh, i'm sorry, director, you said there was a committee.",i
that i'm sorry.,i
i'm sorry if you didn't hear me.,i
"there is, it's.",i
there's a review process of the property itself and its end use.,i
"yeah, i know, but you're not going to be able to get that right.",i
you're going to have to do it yourself.,i
you just said you contact the community.,i
so what's what's the process with the community?,i
there's for the community.,i
"they reach out to community groups or like if, if city planning actually has a community plan, that's there.",i
"they will vet that parcel for its end use against what the plan is, and that's just that's something we have in our code, or that's just something that appalled.",i
"it's a policy and it's been in practice for a number of years, probably since, i want to say, at least 2018- okay, not prior- we recently worked with for iton street.",i
"they didn't mention any of this, so i'm curious to know more about this.",i
i didn't realize that we had a robust process at this at the city.,i
"you know, my understanding is that i mean, i'm totally unaware of this, because there's a house across the street from me on spring hill that was purchased and i don't no one talked to this person, i mean the, quite frankly, the land bank reached out to them to understand what they were going to do with it.",i
so i'm curious to know what you know more about what you're talking about.,i
i've i've never heard of this.,i
they purchased the property for the because they were the highest bidder.,i
"i mean, you know?",i
"i mean, yeah, i definitely think we should check on whether or not they're paying the taxes and if they have a violation.",i
"but anyway, my point was just that you know, there is a lot of concern that you know, i know a lot of council members have brought up in the past about speculation, wholesale buyer buyers and everything.",i
i just want to point out that and i'm happy to learn more about this process that that i'm not aware of.,i
"but anyway, i was going to try and just talk about the land bank and how.",i
"you know, there, we, you know there is a board, there is public meetings about these process, about these pro, about the process of how we vet buyers and you know, to really fund the land back long term.",i
"my, you know my understanding- that would be like the best practice to go forward with.",i
so i just want everyone to keep in mind that the land bank isn't funded past 2026 and i'm going to be setting up a series of meetings to fund the land bank long term and make it sustainable.,i
"so if you're interested in being a part of those meetings, please reach out to me.",i
"and you know, i just want to want to highlight, you know, one way that we can, you know, have a bit, have a greater control over not having to sell to the highest bidder and making sure that these properties are being in the right place and that they are being in the right place to be.",i
"so that's, that's, get in the right hands.",i
"so, thank you, can i just clarify for one moment please?",i
"so selling to the highest bidder, we kind of have to do that.",i
these properties are taken via treasurer sale.,i
"we sell to the highest bidder to recuperate costs that we've already lost, or tax dollars that were not collected, or costs that were expended for demolition or cleanup that were never paid.",i
so that's point number one.,i
point number two: just because we start a sale with a specific individual and the property and the individual was vetted for that sale.,i
people can object to that sale.,i
so this vetting process happens in the very beginning.,i
"there could be other objectors to that sale that we would vet as individuals to make sure that they could individually object to the sale, meaning they don't owe the city any more money, but they could also through a court auction process.",i
"once it gets so far and there are objectors, then it would go to the highest bidder through a court auction, which means the person that started the sale with us that you approved at city council may not be the one that actually ends up with the property, but that is part of the treasurer sale act.",i
this.,i
"these are things that we cannot control, because the point of taking the properties in the beginning is to recuperate lost tax dollars or municipal costs.",i
does that answer your question?,i
is that an projection that we're putting aside?,i
"even though we're using the details here, it doesn't help explain some une güzelball that is currently going on at the city.",i
"once it gets to a certain point in the quiet title process, we can't accept any more objectors.",i
"but if there are objectors to the sale, we post them publicly, not only here in city council, and they may do communities if there have to be any arable tenants or to provide trabajables, we post the location and the 32-00 tenant sale that realimposed breasts by law types and the property documentation services.",i
the sale is going on at 7.,i
3 when you have to go by process and the Harris altered.,i
so i have a lot of tamamlex nursing services to close at the individual svl with the rubles register etc.,i
"so, basically, or the the property And they're advertised to the public.",i
"They're advertised publicly, not only here in city council and they go as part of legislation, but they're advertised as part of the quiet title process And in fact people that border or are adjacent to the property that's being sold receive a letter and notifying them that the property is being sold and they too could object to the sale and purchase it for 10,000 And then they can go and get the money down just like everybody else and start a sale.",i
So there's a person who won the bidding process.,i
Do they have to pay that price or higher?,i
They have to pay what they bid The bidding.,i
"once it goes to court auction, it's held by a judge in a courtroom.",i
"there's an opening bid, which is usually the starting cost of the sale that we started and then anybody who's interested in buying the property we're going to give them.",i
There's no hand money.,i
"No, they put down hand money in order to be an objector.",i
"I'm hearing judge, I'm hearing highest bidder.",i
I just wish we would just talk about just what we have to do by law in terms of the city.,i
"Councilman, if I think I'm understanding what you're asking about and the point you're trying to make, so correct me if I'm wrong, but I do believe that there is a more, I do believe there is a more robust community driven process that the land bank has as part of their sales process, as compared to the one that is within the city's process.",i
"Yeah, yeah, yeah, yeah.",i
"I mean, yeah, I just I'll leave it go.",i
"I just don't understand why we went down this road of talking about the land bank and talking about this other process that I have no idea, But I'm sure there are properties that have been on the books for some time and the you know there is like more engagement on it.",i
"but I mean, the fact of the matter is we have to sell to the highest bidder and I was just trying to bring a light to another process, that we have another tool, that we have the land bank and that you know, although I do think we should still like I'm in the camp where we should still continue selling property through the finance department.",i
that's not what I'm trying to do here.,i
"I'm just trying to talk about, bring a highlight about this other tool we have and how it's not funded past 2026 and how those are the concerns of the table here at city council.",i
"for literally the majority of the time I've been on council, I hear you know these concerns all the time.",i
"So sorry this got a little long-winded, but I just feel like we got a little off track there.",i
"Thanks, Thank you, Councilman.",i
"Thank you, I don't know if we're going to go into second round.",i
"I'm sure we will, but I do have a couple of questions and, at the risk of asking questions, I know there are council members who have really delved into this process, worked with the finance department to make it as sort of efficient as possible, thus resulting in the many, many property increases that we've seen over the years.",i
So I'm just trying to get at like the concern we have before us today without actually talking about this particular issue.,i
"I think it's very clear that the, the, the, the, the, the, the, the, the, the, the, the, the, the, the interested in the property, in part because of the structure.",i
"Have you had these conversations with whoever it is- PLI, DPW- to say these need to be at the top of the list for roof repairs, for building stabilization, Because, like someone's literally interested in getting it back on the tax rolls and paying taxes?",i
Have you had those conversations?,i
"Do you know if they do prioritize that or if there's some mechanism that we could help with, separate from this bill, to help get those prioritized so that they can be at least?",i
"if the process is gonna take a year, 18 months, et cetera.",i
"we know that we're going as fast as we can- and you certainly are, and the courts are as well- that at least the building will be stabilized in the meantime.",i
"So I wouldn't say necessarily a lot of formal conversation specifically on that topic, but there are a number of us that do meet to talk about our inventory and mostly about vacant land.",i
"but these types of conversations do come up and it does usually involve finance, the law department, because they also have a real estate division as well- PLI, DPW and the land bank, And so I think that's part of how we all work together, because some of those parcels that the land bank is interested in are ones that they know that they could take and turn around and may not be in the conditions that they're in, And so that's part of the process.",i
"And then we also have the URA, and I'm not gonna say that they're not interested, but they are interested in a lot of the work that we're doing in the URA and that would be suitable for us to actually sell to someone else.",i
but they also have a group of investors too that are capable of doing that type of work.,i
"So I wouldn't say it's necessarily formal, but those things are taken into consideration when we do talk as a group about how to improve our processes overall between all of us, because we as a city we have to make sure that we're able to get to the point that we can do that We're able to get to the point where we can do that in order to work through the inventory and get it off the rules and back into people's hands and profit generating again.",i
"so Do you think some sort of policy, whether it's policy, internal policy within the city's director's purview or actual formal legislation, would help, Or would that be too restrictive to say just sort of say, wait to formalize it.",i
"is it good, Is it not?",i
what is an informal conversation right now?,i
"Well, the biggest concern that I have is the fact that, at least for us, it has to come out of a trust fund that is just getting healthy and it's always really come down to the cost of it.",i
"So, while we've made great strides and came a long way from where we were, I don't think we're in necessarily a position where we could really go out and expend a large amount of money, because a lot of these fixes aren't going to be cheap in order to assist in property stabilization, which is why we've utilized the land bank to put those things in their hands, because they're capable of doing it where we're not.",i
And then I'm trying to be fair to the city and fair to the person who's bidding In situations like this.,i
I get that it's pretty rare where there's been a request to return haystacks.,i
I don't know if it's because of the sale being rescinded or falling through.,i
"What I'm hearing is that we know we spend money, but maybe we don't track it granularly enough to know how much of that- say 4,000- is being spent in the process.",i
"What I'm getting at is: could there be a splitting- not today necessarily, but in the future- a way to account for that, to then be able to return some of the money that has been unspent.",i
I don't know if that's even possible to calculate in each of these instances.,i
I mean we could look into it.,i
"It might be in the future, not necessarily for this one, but potentially Okay.",i
"Okay, Just thinking of all the ideas.",i
"again, these are probably questions people have asked in your group, in your task force, in the various departments, on council.",i
I'll just sort of.,i
"I'll just sort of, you know, encountering this part of it for the first time, I will reserve any my future questions for later and move to second round, I believe, unless we have others.",i
So we'll start with Councilman Coghill.,i
"Thank you, Madam Chair.",i
I just have a few questions.,i
"I promise I'm not gonna keep you here long, Too late for that, I know.",i
But I want you to know this is not a reflection.,i
You're doing exactly what I want you to do as a director.,i
You need to protect that fund.,i
It's like getting it to the board.,i
You need to protect that fund.,i
You need to protect that fund.,i
"I'm not gonna keep getting it from the jaws of death with you, which is great, We want that right.",i
We want you to be a fiscal watchdog.,i
"But let me ask you, this director Of that fund, a million dollars so we put in a third.",i
Where is?,i
is our?,i
"is that completely in the city's hands, that money?",i
"So the- because it's always been in the, operated in the negative pretty much the city- any of the, any of the proceeds that were actually made back into the trust fund just to like cut grass- And we even know that in the past, like the maintenance cost, even expending, that has been, and you know there's employees that get paid out of there as well for the work that they do, specifically on property sales.",i
"Yeah, I understand why you're protecting them.",i
So there's not really.,i
"yeah, So the money that's generated, there's really nothing extra, right, But it's three TB, that's three taxing bodies.",i
"Yep, Does the school district?",i
"does the school district how it makes that money or The way it should operate is is: yes, they would, but we would also be required to profit, share with them as well.",i
"Okay, So they could contribute, but we'd also be responsible for paying them.",i
"But they don't contribute, But we don't pay them either.",i
"Okay, okay, There's no, there's no proceeds to share.",i
"Got it, got it.",i
"So the money that's there just keeps getting recycled, Okay, yeah, So so I wanted to go back to 200 and say what is there?",i
"250 structures, is that somewhere in the ballpark Or no, I'm sorry, three, four, maybe even up to 500, but no more than 500.",i
We said 95% is really land right?,i
Probably So.,i
"and then you clear 250 and 23, So we've got to get be getting close to what.",i
"do we have a couple hundred left, 250 sales, not Sales, But that includes buildings and land, Oh Right, Okay.",i
"well, there you go, Of which most of them were probably vacant, I understand, right, right, So you sell more land or more building, more land, Well, more land, mostly because the volume of the actual inventory is mostly land and not buildings.",i
Got it right.,i
"So we still have hundreds of structures, I'm sure.",i
"And, to be clear, these structures are probably dead end properties when we get them.",i
"Absolutely right, right, That sat vacant for a number of years, So they're not in good condition ever, I know.",i
and that's my next question is: how many do we acquire every year that fall into our hands?,i
"basically, right, So not many On an average.",i
"I think the last treasurer sale maybe we had 50 parcels available, but we weren't actually putting parcels in a treasurer sale unless we knew that there was a buyer that wanted them.",i
"So Okay, and ones that we're acquiring now.",i
"the idea, hopefully, is that get those going directly into the land bank as well.",i
"And, like Mr Wilson noted, you know the land bank is going to need money And that's one thing you have right now, which is fortunate.",i
