sentence,classification
"Good morning and welcome to the standing committee's meeting for Wednesday, April 16- 2025.",b
"All council meetings will be will be live streamed on the city's website and, for those joining us at the table, please do not turn off your microphones.",i
Our first order of business is roll call.,b
Will the clerk please take the roll?,i
"Mr Sharland Here, Mr Coghill, Ms Gross Here, Mr Lavelle, Mr Mosley Here, Mrs Kale-Smith, Mrs Warwick, Mr Wilson, Mr Sharland, Ms Strasburg Or chair Here.",i
Four members present?,i
"Okay, Now we have Councilman Wilson joining remotely.",i
"Thank you, Hi, Erica.",i
"Hi, Chair, I'm here, Thank you.",i
"Thank you, Okay, Five members present.",i
"Thank you, Madam Clerk.",i
Our next order of business is public comment.,p
"I would like to remind all speakers that rules of council state that comments are limited to matters of concern, official action or deliberation which are or may be before City Council.",i
Profanity will not be permitted.,i
Please state your name and neighborhood for the record.,i
You will have three minutes to speak.,i
Our first registered speaker is Azasha Mennefield.,p
We don't see them online.,i
"We do not see Azasha Mennefield in the chamber, So we will now move on to those in the chambers wishing to speak.",i
Please approach the podium.,i
"Good morning, My name is Yvonne F Brown.",p
"I live at 715 Mercer Street, up at the top of the hill That's Crawford and Bedford- Red alert.",i
"My councilman is not here, but there are two of you sitting here looking at me.",i
I want you to please tell my councilman that you come down to Bedford.,i
You got one One side of the hill.,i
you go down One.,i
you're supposed to come up.,i
"Well, about 830 last night I happened to be looking down and I seen two cars going down Bedford at the same time.",i
One that's not supposed to go down there.,i
"There is a—the only reason why I'm bringing that up, because if you don't know about that area, you can get mixed up And I see where, if they just put even an arrow to point one down, you got to go this way.",i
There was two of them.,i
How about that?,i
"Actually, One of them was going down and one's supposed to be coming up.",i
They were going down at the same time.,i
That person on that left-hand side did not know it And we do need a sign.,i
"I wish you would—if one of you would go up there and actually look If you're coming down, you would not know it.",i
I know it because I live there.,i
But please- I've seen a couple cars go down there before.,i
"Also, I'm still upset about Corey.",i
Now this is Corey's.,i
He's running for mayor.,i
"I couldn't find the one of Ed Ganey, but it was dark like this.",i
See this blackness.,i
This is how they made dark—made- the mirror.,i
"I don't care for the mirror myself, but right, don't wrong nobody.",i
"They're trying to put fear into us that he's dark, sinister, something's wrong with him, Whereas with Corey they got him, Oh, his natural color.",i
But they made Ganey.,i
"See, you just play the race card and you say: we do.",i
I didn't think about that until I seen it.,i
I said how the mayor gets so black?,i
They made him that way.,i
He's not that color And I want you to understand.,i
we as black people see it.,i
"You just might pretend like: oh, we don't—we didn't do it.",i
But we see what's happening.,i
That man is not that dark.,i
How come he got all black just before it's time for him to run for election?,i
The same way with Petit Up in his—up in our area.,i
he got a big sign for Petit.,i
He got a big sign for Petit.,i
He got a big sign for Petit.,i
He got a big sign for Petit.,i
He got a big sign for Petit.,i
He got a big sign for Petit.,i
"For Petit, he's running.",i
"Well, let me tell you who else is running This man: Jeff Woolwolf, W-O-O-D-A-R-D.",i
Now someone- one of the residents in my building- told me he was in the building the same day that Lavelle and his man was in the building.,i
This man is running for Petit's job.,i
Now I have a problem with Petit Because of him.,i
"we have that actor, the bad actor that keeps coming.",i
"That bad actor, That bad actor, That bad actor, That bad actor, That bad actor, That bad actor.",i
"And he was coming in the building because the police said, not me, they're dropping the ball.",i
"He said Arbor and Petit, And he is dropping the ball.",i
And the reason why I'm saying that I've got one more.,i
"My time is up, But anyway, please help us, Please.",i
Thank you very much.,i
"Next speaker, please.",p
"Next speaker, please.",i
Thank you very much.,i
"Next speaker, please.",i
Good morning.,i
Special Agent Sunshine.,i
how's everybody?,i
Everybody's not here.,i
"God, you're amazing.",i
I know what you're doing in the background.,i
"Lord, please protect me from the voodoo, hexes, curses that may be sent towards me in this chamber.",i
I return them to send a 100 million billion trillion Google Plex And whoever's sending them.,i
throw them into a lake of fire.,i
"In Jesus' name, I pray Amen.",i
I'm going to start with the wisdom for today.,i
It comes from Proverbs 21: 13.,i
It says those who shut their ears to the cries of the poor will be ignored in their own time of need.,i
A lot of people being ignored.,i
It's not good.,i
God is very angry about it.,i
God blesses us so that we might bless others.,i
"My cup runneth over because I'm here to be a blessing, Not to get blessings.",i
You can't get one without being one.,i
It doesn't take an hour to preach that A woman of character loves herself above all others.,i
We love God and ourselves.,i
"But in this world that we live in today, we have misogynistic men who have a problem with women: Strong women, Independent women, Educated women, Saved, Celibate women.",i
They have a problem with us.,i
You know why?,i
Because God created us for them.,i
God created women for men.,i
"It'll never be the other way around, And misogynistic men have a real big problem with that.",i
"Well, if I'm the problem, I'm going to be the brightest, shiniest problem a misogynistic man will ever have, And the one I speak of today.",i
his name is James Engle.,i
"He's the man who runs the Northside Overflow Shelter, who is a misogynistic man.",i
He had a problem with me leaving and his employees helping me with my luggage.,i
He wouldn't let them do it.,i
"It was very, very ugly, And Maya Angelou once said: you never forget what people say, but you will always remember how they make you feel.",i
And the way he made me feel Was stronger.,i
You know why?,i
Because I moved everything that I had to move myself.,i
Because I praise God for my health and my strength In Jesus' name.,i
"I pray that he has the health and the strength that he's going to need for the karma that's coming for him, For how he treats people, Especially women.",i
Proverbs 31.,i
10 says an excellent wife who can find she is far more precious than jewels.,i
I'm not married yet.,i
"I'm kind of running from men, But God is stopping me at my trace.",i
Amen In Jesus' name.,i
Amen.,i
Thank you very much.,i
"Next speaker, please Are there any further speakers Seeing none.",p
we will now move on to our standing committee's agenda.,b
Our first committee is the Finance and Law Committee And we have one deferred paper: Bill 1634.,b
Bill 1634 resolution repealing an item in resolution number 512 of 2022.,i
"Effective date: September 23, 2022.",i
in order to rescind the sale.,i
Motion to approve discussion.,i
"Move a second, Oh, second Second With discussion, Councilman Coghill.",i
"Okay, thank you, Madam Chair.",i
I would like to.,i
"I guess let's just start with bringing To the table Mr Geiger and the others here that can answer any questions as far as this, Why I put this bill in.",i
"Director Gula, thank you, Yes, Good morning.",i
"I'm Jen Gula, the city treasurer and director of finance, David Geiger, legislative and policy director.",i
"Okay, thank you, Thank you both for being here.",i
"Sure, We spoke about this last week- I think was the last week- But now I've been struggling with this right.",i
"Okay, Just because it was brought to my attention.",i
I never.,i
"I don't know how processes work in certain departments in the city of Pittsburgh, But I just want to for other council members to know the kind of how it came to my attention, And then you could fill in the gaps and questions that we might have for you.",i
"Okay, Thank you, Thank you, Thank you, Thank you, Thank you, Thank you, Thank you, Thank you, Thank you, Thank you, Thank you, Thank you, Thank you, Thank you, Thank you, Okay, Thank you, Thank you, Thank you, Thank you, Thank you, Thank you, Thank you, Thank you, Thank you, Thank you, Thank you.",i
"Okay, So we have a process where, if somebody wants to purchase a city-owned property, they put hand money down, And is there a certain percentage that's always on that, Or is it always on the percentage of that sale of the building?",i
Is that right?,i
"It's a percentage of the sale of the building or the land, or 250, whichever is greater, Got it, Okay?",i
"So a constituent- Yeah, So a constituent, Yeah- came to me- this property lies in brookline, my district, of course- and told me the scenario that they had went through.",i
so what happened was they put the hand money down in expectation to get the property.,i
"you know, obtain the property, i think in our forms it says it could take anywhere from 18 to 12 to 18 months or something of that nature.",i
"so, so she put the money down, and a substantial amount, i would say, put the money down and i guess we put that money towards the administrative costs and things of that nature.",i
"is that, is that what we do with that hand money?",i
or do we just hold that?,i
it goes in escrow?,i
"because an escrow, okay, good, good.",i
so it went beyond the 18 months.,i
"it was, i think, a little bit over two years, finally that this person decided- you know what the place looks like- it's deteriorated beyond what is really repairable, okay.",i
"so he or she was asking for money back, right, and we talked about this.",i
"we were worried as a city that it might set precedence, because we don't typically do that- it's in the agreement- whereas you know you put the hand money down, you're kind of tied into the property at that point.",i
"there's no refunds, basically, well, not entirely okay.",i
so that's on the bills ofrez against you small area houses.,i
"but yeah, are there any real some other documents like hyphens, mentioned in, i think, maybe the statue, whatever?",i
is there stuff around the council?,i
so the reason why this last thoughts is continuing to take- i think that's what the discussion is going on for a wholeOUR.,i
"Okay, I just want to state that as the city, I think we have issues with our process more than anything.",i
But you're correct and you know we don't want to set a bad precedence.,i
"It's not, it's kind of in the agreement, but also in the agreement is eight, twelve to eighteen months and you know Things of that nature.",i
I think what's really wrong here- and the reason why I want to- I really wanted to just bring this to Light so we can correct this moving forward- is the 24 plus months right Now.,i
"I rode by, I go by this house, houses right at the bottom of the hill for me.",i
I went by there today and I'm telling you there was holes in the roof of this big around right.,i
"That's like bad, bad news all the way down, right.",i
I mean it's like This person is probably not the right person for this property.,i
I will tell you not at this point.,i
"The right person is somebody like me: a general contractor come in and has to like kind of strip this Property down to nothing, basically, and rebuild it.",i
That's kind of where I feel that's just an outside observation from the ground.,i
"I wasn't inside this place, I didn't inspect it or anything of that nature, right?",i
"So So this person wants to move that down payment at four thousand dollars That they had put down for the to the shore, that cost to shore this property up to another property, and we don't do that either.",i
We have not done that.,i
We've not.,i
"there's not a president's of that, That's not.",i
we've done it one time.,i
"Okay, and we did it one time because Solely on the part of the city, the and it may have even come to A point where their original application had been lost, and there was some.",i
"It was one of the sorbs, It was one exception to the rule.",i
I understand We don't want to make this a norm.,i
I get it.,i
I think you're doing the right thing by sticking to.,i
"you know, yeah, we don't.",i
"you know We don't want to go off course, share- We really don't.",i
and then who knows?,i
you know how many sales are pending out there.,i
I have no idea.,i
I'm honest with you.,i
"I have to say that the reason that it's like this is because at a certain point, the city starts to expend money in order to complete the sale.",i
"so we Pay, like quiet title costs which we hope to recuperate at the close of the sale.",i
"So, and this money comes out of the 3 TB trust fund, a trust fund that we've worked extremely hard To keep from going into the negative and have built it back.",i
"So if we consistently allowed people to actually do that and refund all of that money after we've expended it, Then that becomes a problem.",i
"right, I agree, and You know, to be honest with you, I'm not necessarily asking you to refund this person's money.",i
"I think that it is the right thing to do, and you know.",i
But I don't think we're in a position.,i
"We'd have to get our solicitor up here and, I think, talk further about this.",i
Unfortunately we don't have the time right.,i
"the sale of this property is coming up, I think within two weeks, as to that person needs to act on it or we just need to rescind the sale and they lose The money, right.",i
so so that's where we're at with this.,i
"I would love to Refund this person, but I understand exactly what you're saying.",i
"Okay, but again I feel like we're bad Realtors here.",i
I guess you right.,i
"I mean, we take hand money down and again this substantial amount, four thousand dollars, I think it's okay for me to say that, You know, on a piece of property that at the time was probably worth every bit of what that person's paying for it, two years goes by And again I'm almost positive.",i
"I can't say certainty, but the person would not have, You know, went ahead with that hand money had they seen the hole in the roof this big around in the front You can see from the street, you know, and that tells me basically big, big, big problems, right.",i
"So whether it was bad decision from their part, maybe, you know, maybe that place wasn't inspect out, in inspected two years ago.",i
Did it just all fall apart in two years?,i
I can't say that.,i
"you know, I could tell you that hole probably wasn't there because that would have been like so.",i
"so my, what I'm really trying to achieve is Moving forward.",i
I feel like we need to move these properties.,i
"We don't have to move them if we stabilize them though, right.",i
I mean I mean just bring in public works crews.,i
"right, We could do that in-house.",i
I would hope just to out of the 3 TV trust fund.,i
It needs to be paid from there.,i
"So unless that trust, we can't do in-kind work from the city.",i
"No, we can't say W charges us if we send.",i
"you know, if we send public works crew out to board up a building because The windows were broken out or the door has been compromised, I mean we charge us for it And it goes.",i
it gets charged to the trust fund.,i
"so I mean, Ideally that's the place that we would like to be in.",i
"director Hornstein, We're not you a bill, basically, For we pay holding it up and that goes.",i
where's that money?,i
"I'll go to it, It would go to them.",i
"or even if they charge us for demolition, I mean we hope to recoup costs on demolitions when we.",i
"but it gets, you know, bill to us.",i
"We may not pay it instantly, Instantly at that moment, but eventually, you know it's supposed to come from that trust fund and reimburse this.",i
"It's not necessarily in kind and something like repairing roofs- It gets paid out of the 3 TV trust fund, like we would have to Secure a contractor and pay for it.",i
"So even if you use in-house, were built for it, something like that- It's likely to give you a discount at least.",i
"So, anyway, what my point is this: moving forward, We need, if we accept hand money on a piece of property and if we're not sure, we can turn it around and say eight months, First of all, I'll need to be in writing.",i
this all needs.,i
you know that we have 12 to 18 months.,i
It could take.,i
this took 24 months.,i
"We need more clarity, right, We need to do in a certain time period or we need to stabilize.",i
I think the best thing is stable.,i
"part of that timeline, though, is also attributed to how fast the actual purchaser acts.",i
"so this specific purchaser we requested- I think we sent them a letter in October of 22- Said that the legislation had passed and you're now required to give us a title report, and we didn't get it.",i
It's supposed to be in within 60 days.,i
"We didn't get it until like four months after that, So we didn't get it till sometime in January.",i
"Yeah, I'm not Like China And we say 12 to 18 months, but there could be.",i
"there's things that we don't have control over and part of that is quiet title with the courts and Even though we may file a petition, it could take a long time for it to move through the court process in Order to get final orders and complete it.",i
"Okay, and let me just stop right there for a second.",i
"So if They, you know you do all the title clearance whatever- you pay an attorney, I guess, to do this groundwork.",i
"So if, like this person's asking to switch that credit that they put down to another property- What amount of work is done On that first property that we don't have to do again- that we could credit this person for meaning title clearance.",i
"right, I mean right, there's certain things that are done out of that hand money That will be there for the next buyer that we don't have to do again.",i
That's what I'm asking.,i
"right, we would put it up for what they call sealed bid and we would put a bid amount and send a letter to.",i
I Guess whoever else was interested in it could apply for it and we'd have to Put up for bid where they would enter in a bid price through them.,i
"I mean, we have to go through the whole same process for, so say, for instance, If we gave this person back there, refunded their hand money, Would you have to go through the same process every part of the expense that the titles already quieted, Expended the money for it.",i
"So it's title right, but it's quieted title in the name of the purchaser, So we would probably have to go back to court and adjust it to the city.",i
"Okay, I'm probably getting off too fast.",i
"Okay, I get it.",i
"You know, I know there's this complicated, believe me, and that's why I struggled with such a thing.",i
I'm like I've never been in this situation.,i
"David, you can say I'll let you speak as soon as I'm done with my last point here.",i
"Okay, the ultimate goal here, I feel, is like: right, this is a person, a young professional, wanting to go through the city of Pittsburgh, purchase a Affordable home.",i
what they thought or think is an affordable home.,i
"so Again, when I say we're bad Realtors, this person's leaving losing their hand money.",i
"I'm not, I'm not casting blame on us or this person, necessarily, But this is the result and sour to our process.",i
I'm sure I haven't spoken to that person on those terms and We got a property that's still blighted and sitting there.,i
"and you know, I'm thinking, if we did just stabilize this thing, I'm sure that person would have gone through with this sale and we'd have this thing back on the tax roll And so.",i
so now I still got a blighted piece of property there.,i
This person doesn't have a home and probably can't.,i
"You know, I don't know what 4,000 means to this person, Right, but to me it's a lot of money, to me still, right, and I'm 60, so So, so that's my goal is really to get the process moving.",i
I would like to see a stabilization now.,i
"I understand, director complications.",i
"if public works is billing us, Maybe we could straighten that out here at the table.",i
"I don't know, You know, I have no idea, to be honest with you, But but if we can use public works people just to do the basic repairs, So this property doesn't deteriorate to a point where it's- and you, you couldn't even move in this property for a year, There's that type of work to do: chimneys, roofs, Windows, siding, doors, you name it right, That's just the exterior.",i
So so I just don't want anybody else to be in a bad deal and- and I'm not saying we set this person up.,i
This property is probably worth what we're asking for to somebody like me who can come in with trucks and labor and not Expend that type of money on it.,i
So so I like the asking price.,i
"I just really want to make good for this person so they can use that money and- and if we can do it in any tricky way- Transfer, I don't know, you know, just find a way where they can still put use that some credit.",i
there Doesn't have to be all of it.,i
"you know, if we could Figure out what we expended on the first time that we don't have to this time, Maybe there's a difference there, I don't know.",i
So so that's my goal.,i
"Okay, I know you're uncomfortable with it, I'm uncomfortable with it.",i
"I I wish you, you know, wasn't in my lap to be honest with you.",i
So so go ahead.,i
I'm sorry.,i
"Yeah, please, Councilman, I just wanted to, you know, make sure that we're addressing your, your global concern, and not just the the minutia of this sale.",i
"right, and you know, as we've discussed, you know, we want to thank City Council for their work and investments on tools like the land bank.",i
I think the situation we're talking about here on a.,i
you know the specific case is Really well suited for a land bank transaction in the future.,i
the process started well before we got the land bank up and running and moving and processing properties.,i
"But the the flaws in the city sales process from a structural standpoint Right, are the reason why we've worked so hard to get the land bank functional after a decade of it not being functional.",i
And so I I just wanted to point out that you are correct.,i
"This probably isn't a, you know, great process for the scale of the project, for the individual in their capacity.",i
"and To your points about improving the process, I think we've already done a lot to improve the process and make the public options available through the land bank And you know that's a credit to City Council as well.",i
I Agree and you're absolutely right.,i
This really belongs in the land bank.,i
I feel right.,i
"I mean, this is what we kind of created the land bank for.",i
"this still, like you said, started before, So wasn't could even be part of that process.",i
"I guess could this sale of this property go to the land bank now, if I Mean- I Don't necessarily know the legality of it- We recent, if we it wouldn't solve, to answer your question, Most simply wouldn't solve the question at hand, which is that the legislation on the table right now does seek to refund the hand money, Which we'd like to see amended.",i
I think we would still like to see that part of the bill struck.,i
"and then whether or not it makes sense To move forward with a land bank transaction is a question beyond you know, the, the director and myself.",i
"it would have to involve You know land bank staff and other individuals talking to the interested party here and trying to figure that out, But I do think it's a potential solution for sure.",i
"Right, Is there a Director?",i
"is there a record of others asking for their money back, or is that something that doesn't commonly happen, or is it?",i
"there are some occasions where people do ask some situation like The buildings, like not what I mean.",i
"you know various situations And we've denied every single time: Okay, Well, that's, that's Even in the man.",i
"someone did take us to the magistrate over it and they held our contract, got it.",i
"Yeah, I understood, understood, And again, I'm not really trying to.",i
"I don't want to city to do something It's not comfortable with in a legal way, honestly.",i
"so I'm gonna vote for it Anyway today, just out of principle.",i
"but You know, I really Hope we could just dive right in and change how.",i
"to be clear, We're not against the principle, We're just Against, I guess, a precedent that it could set in the future.",i
"I believe that could bankrupt that trust fund and you should be, yeah, and you should be honestly so.",i
"you know again, I'm not casting fault or blame, I'm just saying when we take hand money on a piece of property, It should be at least in as good as shape as when we took that hand money.",i
But let's be clear.,i
this first point is: I'm gonna leave these times easy.,i
I think that is.,i
I would agree fully.,i
So you give me your take on this Question.,i
"first, Yes, you can probably see.",i
I thinkidades in a delay.,i
I haven't actually read it.,i
I'm gonna period.,i
Second question: definitely Ask: What is this difficult right here?,i
It's just this: this Consumption of money is absolutely Right.,i
I'd go this way.,i
So two families have iso.,i
The simplest solution here is shortening the amount of time that the sales process takes that way.,i
I agree with you in principle.,i
"Our goal should be, when somebody enters an agreement of sale for a property, that we should be moving as quickly to get that out of the public hands and into their hands so that what they've agreed to buy is in a substantially similar state and that they're able to get moving as quickly as possible.",i
