sentence,classification
"I think that benefits the individual, it benefits the neighborhood and the residents surrounding that property and, ultimately, is a fiscally responsible decision for the city, which is again why I will keep emphasizing the use of the land bank as a tool.",i
I think some of those other solutions you're bringing up may have been worth exploring.,i
"if something like the land bank— I got you- If we didn't have the land bank, the land bank wasn't up and running.",i
"You're not saying more Honestly, you're right on.",i
You really are.,i
This is an unfortunate situation.,i
I'm really just trying to—the person.,i
"I'm sure this money means a lot to them, and probably the difference of them securing a home or not.",i
I want people to be encouraged to use the city process to buy these homes.,i
I guess it's hard for me to speak up because I have no clue as to what the rest of the inventory looks like.,i
Is it buyable?,i
Is it movable?,i
"How much money do you have to put into a certain property, But this certain property, if this council doesn't approve this money back.",i
I don't think this candidate or this person has the resources.,i
It's going to be a quarter million dollars to bring this place up to speed.,i
I will tell you That's what I'm thinking about.,i
That's conservative.,i
I mean everything right From the top to the bottom.,i
Maybe the frame- Hopefully parts of the frame- are good.,i
"So, again, it was really the wrong customer for the wrong house and that's probably not our fault, honestly.",i
"That's all for now, Thank you.",i
Thank you for your time.,i
I think it's time for me.,i
"I guess I'll open up to other council members, Appreciate you working with me on this and hopefully the land bank could settle all this stuff for us in the future.",i
"So thank you, Madam Chair.",i
"Thank you, Sorry it takes so long.",i
"No, that's okay.",i
We have a couple of other members who have indicated they'd like to speak: Council Member Warwick and then I know Councilwoman Gross online would like to speak.,i
"Hey, thank you.",i
"Just so I'm clear on Okay, Okay, Okay, Okay.",i
So we had someone who wanted to buy.,i
This was a city-owned property- Someone who wanted to buy it.,i
How much was the for sale price?,i
"40,000, Okay.",i
"So they wanted to, So 40,000, and they put down 4,000, Like a 4,000 sort of hold.",i
What was this?,i
"4,000, Okay, And they put down 4,000, Yeah, So they put down 4,000.",i
"And they put down 2,000, Yeah, 2,000, So, 2,000, Okay, So every time they'd like to, So we have a chance to go inside and check it out and all of that Yep At the beginning.",i
"And was there some kind of like report, Like you know, state of the property report or something like that?",i
"We don't do that, but we will set up a.",i
"Okay, If they wanted to go in and view the property, they could bring whoever they'd like to go and view it with them and give opinions on how much things would cost and what repairs would be needed.",i
They could bring whoever they wanted to.,i
"Okay, So they could anybody.",i
"and then- that's part of the process- they could schedule a viewing with the staff and they'll take them out- Okay, to the property, open it up for them and they can go in and see- Okay, whatever they needed to see.",i
"and take any contractors- Okay, I wanted to with them.",i
and do we have someone there?,i
"like, if they want to do that, Do we have someone there?",i
they set up an appointment and my staff go out with them.,i
"Mm-hmm, They coordinate ahead of time.",i
They set a date just like you would.,i
"for you know, like a, I'm just a real estate agent, okay, open, not necessarily an open house where it's open and people come in and out, but they would schedule a viewing and After that they, if they decide to move forward, what they signed, some contract that says there's a proposal to purchase, Okay, that they sign it's a contract, and they put down their hand money, Okay, and then we send legislation to City Council- I think we actually have legislation on the books today with a List of properties that those are people that have applied, they've been approved as buyers.",i
They put down their hand money and now we're presenting them to you to okay the sale those properties to these individuals.,i
"okay, so, and in that contract does it say anything about, like, You're compelled to to go through with this?",i
"it, Regardless of what happens to the property between now and then?",i
"it does then okay, Okay, So.",i
"So we don't actually know, Sort of like, the state of the property.",i
"we don't have a record of the state of the property at the time that this initial exchange happened, Like whether there was a hole in the roof or whether now, so we, okay, Maybe that would be something to Even just like a, I mean if we're there anyway normally.",i
"so when we price a property, we look at comparable properties in the same area in order to determine a price.",i
"normally, if the staff is aware of compromises like that, some especially something that's visible, like a hole in the roof that you could see from the street, those things would have been noted and taken into consideration at the time of the pricing.",i
"okay, okay.",i
"so i mean, do we acknowledge that the whole came over the course of the?",i
"i would assume it would, would have come after, or else we probably would have noted that there was a hole in the room, there was a hole in the roof, okay and okay.",i
"so so the contract was signed, the they paid their four thousand dollars.",i
"you know, they put down their four thousand dollars and then you said there was, we sent them something and then it took four months for them to send it back.",i
"so after we send the legislation to council and council approves the sale, usually send a letter okay, stating that council has approved your sale, the sale is ready to move forward.",i
"you need to secure a title report and i think we give them 60 days, okay, in order to they're they're responsible for getting one and submitting to us, okay, a title report.",i
that title report is then used to start the quiet title process.,i
got it okay?,i
"so the 60 days, so two months, do we send like a reminder, like maybe they didn't get the letter or something like that?",i
i'm not sure if they do they.,i
i think manda might reach out if she notices that there's no response and it goes on for a while.,i
"okay but, and she may do that by phone or email, okay, okay, but in any case it was, it was four months to get get the quiet title process moving.",i
"yep, and then, and- and i know that this can vary, but in your experience, what is assuming you had, like you know, an attorney who was ready, you know, just had nothing better to do but quiet this title right, what would be, generally speaking, the, the fastest turnaround generally on on quieting a title?",i
"like eight months to a year, that's moving really quick i think and that depends on.",i
"so, as part of the title report there's a list of basically a creditor, like anyone that would have any financial interest in the, in the property, that, or any attachments, and they have to send notice to all of those people in that list and they have to give them a certain amount of time to respond in order to object to the quiet title of the property.",i
"so, depending on whether or not they hear back from the those individuals, they may have to mail things multiple times if they get no response from them.",i
"okay, so that.",i
"so that's like a year, basically, no matter whether you're the land bank, whether you're the city, whether you're, it takes, it takes months to actually do that, but it's at least 30 to 60 day notice, and if they don't receive something back, it may start that time clock all over again.",i
"okay, so, even like best case scenario, we're at 14 months, right, because of the initial delay and then, and then quieting the title.",i
the quiet title is the longest part of the process.,i
the quiet titles hands down.,i
"so, oh, and here's a question, how much do?",i
"well, do we know how much we paid to?",i
did we quiet the?,i
"we quieted the title on this property, okay, and do we know how much we paid to do that?",i
it's at least.,i
"i think it might actually depend, but i'm not entirely sure, but we did expend money to do it.",i
"So, a couple hundred dollars at least.",i
"Oh, just a couple hundred dollars.",i
It could be upwards of that I don't know.,i
Are you sure You know offhand?,i
"I'm sorry, That's okay.",i
I don't think we have a known cost.,i
"in addition to attorney's fees, You'd have to calculate in staff time and capacity spent.",i
These are all sort of the expenses to the public that the hand money is meant to account for.,i
"But it probably wasn't 4,000.",i
I have no idea.,i
"I don't know how much staff time or attorney time was spent on this property, So it's hard to say It really is.",i
"The filing fees could be a couple hundred to 1,000, but there could be more involved in that.",i
"Okay, Okay, And then again.",i
so I guess I'm a little confused too about DPW.,i
"So you know we have DPW workers who come and board up a house that we own, right?",i
"Yeah, I guess I didn't realize that either.",i
So they like invoice the finance department?,i
"Yeah, they can.",i
"I mean, they have costs as well.",i
"Sure, sure, sure.",i
"And this isn't like: keep in mind, we say city property, but these aren't strictly city-owned properties.",i
"These are properties that we took in treasure sale and the financial interest doesn't just lie with the city, It lies with the school district and the county, Mm-hmm.",i
"So, which is why there's a separate trust fund, Got it?",i
So DPW expends money in kind for properties that we own outright.,i
"Okay, That's their job, Got it Right.",i
"Okay, They maintain our city-owned parcels and buildings.",i
"Okay, This is not that These are separate.",i
Now I'm understanding.,i
"Okay, so that is because these properties are not just.",i
"it'd be like if me and my three friends owned a property and there were costs, all of us and this person did work.",i
"Yep, We're all.",i
that's how we all.,i
it's like a joint account that we all three pay.,i
"This trust fund would be responsible for paying any like water bills if there was water turned on, Got it.",i
Electric bills: It comes out of there.,i
"It does not come out of DPW, Got it?",i
It's like your joint account with your spouse or whatever You're like.,i
we pay all the family expenses out of this and then we have our own accounts for our own.,i
"That's exactly right, Right, right, right.",i
"Got it, got it, got it.",i
Okay.,i
So that makes a little bit more sense.,i
"Okay, So I guess I understand, and now just sort of a.",i
"so, generally speaking, because I understand, like, and you know, I'm very glad that the land bank is doing so well, So could you just overall sort of over, like last year, how many properties did the city move To sell.",i
you know how many properties did the city sell through this process?,i
Through this process?,i
"it's a couple hundred, which is actually the most that we've ever done.",i
"That was in 2024, Yeah, Okay.",i
So like 200.,i
and do we know how many we did in 2023?,i
I'm slightly shy of that.,i
"And then, prior to that, like, well, during the COVID era, next to nothing, Okay, And then prior to that, maybe 30 properties a year, Okay, Maybe, Maybe, Yeah.",i
So what has been the difference?,i
"Like, what's been the difference from?",i
"like 19, or just 19, 2000, I don't know- 18 between 2022?",i
"Like, what's the difference?",i
"Do you have more staff, Some of the process improved, better staff and process improvements that we have made?",i
"Okay, And granted, it's not perfect and it still is long, but it's way shorter than it has ever been and which has allowed us to actually do that.",i
"Yeah, Yeah, Yeah, Yeah, Yeah, Yeah, Yeah, Yeah, Yeah, Yeah, Yeah, Yeah, Yeah, Yeah, Yeah, Yeah, Yeah, Yeah, Okay, Yeah, Yeah, Yeah, Yeah, Yeah, Yeah, Yeah, Yeah, Yeah, Yeah, Yeah, Yeah, Yeah, Yeah, Yeah, Yeah, Yeah, Yeah, Yeah, Yeah, Okay, Okay.",i
"So, some to the URA, some to the land bank and some to, but we've significantly- It's like a third, a third, a third, so- Okay, Okay.",i
"So that's a major increase, So that's good, Okay.",i
"So now- and this is my last question, so just so I'm clear, so we're this.",i
this bill is to refund the person their money.,i
"Yes, And from your perspective, this is not something that we do.",i
"Once it reaches, once a sale goes past council approval and the city starts to expend the money to quiet the title and to complete the sale, then anything, if you were to back out of the deal after that point in time, then the city sees it as a forfeit and we keep the hand money in order to account for any holding costs or attorney costs that we would have incurred during that time.",i
And is that clear to the buyer up front before they?,i
"It's in the proposal, Okay, And it's in.",i
I think it's posted even online.,i
There's a standard sale process and I believe it's actually there as part of the standard sale process.,i
"Okay, And so, with this particular buyer, I mean, was there like some?",i
"well, I guess I don't know if it was like.",i
"I mean, I get it If it was someone who was confused or thought that it would be a great idea, I mean, you know that happens- like, oh, that'd be a great idea, Let's do it, It'll be easy, you know.",i
"And then it's like, oh my gosh, it's not.",i
it's actually not as easy as I thought it would be.,i
"And but we're worried of like sort of like a slippery slope, like if we do it for this person, Then we would, then we open the door, Then it would be like precedence to do it for other people.",i
That's right.,i
"And a concern is, if you allow even to transfer that money from you know this property to another one that they were wanting to purchase, what if they fell through on that purchase and then they wanted to do it to another one?",i
"Like, where does?",i
where's the line in the sand that we draw?,i
Do you see what I'm saying?,i
"And is the reason that we is, the reason that we take that down payment?",i
"is it because we're about to dive in and like spend a bunch of money to like quiet this title And so we don't want people just be like: oh yeah, I'll take it, sign me up.",i
"And then we spend all this money to quiet the title And then they're like: oh yeah, nevermind, Sorry, I'm not really interested.",i
So that's what this is about.,i
It's like.,i
"it's like you know, you have a catering business and someone's like: I'm having a big party And you're like, okay, great, Give us whatever Cause if we buy a bunch of stuff and spend a bunch of money and then you back out And they're at least compensated for what they put out.",i
Got it In order to handle your party.,i
Got it?,i
"Same thing, Okay, well, thanks, Same as any other real estate transaction.",i
"I mean, when you go to buy a home from a realtor, you do the same thing.",i
"Okay, You put down earnest money and start the sale process, Okay, And they use that, for it goes against, then, what you your closing costs.",i
"So, or if we were charging her 40,000, Okay, and she gave us four grand, I mean it comes off the balance of what she would owe at the closing.",i
"So, Okay, That's all the questions I have.",i
I appreciate it.,i
"Thank you, Thanks, Councilwoman Gross.",i
"Thank you, Madam Chair, Just trying to keep my microphone on here.",i
"Thank you, Director Gula.",i
"I just want to put things in context And again for my colleagues, you've, you know, we've kind of gone over this before, so forgive me, but I think it's important for the public to kind of put these things in some kind of context, And I don't have all the numbers in front of me, Director, So we can just have ballpark numbers if you don't have them in front of you as well.",i
"But in my last recollection, looking at the entire list of properties that the three TB that we, the city, has control over in the treasurer sale inventory is what we usually call it- It was roughly about 10,000 properties.",i
Is that still true?,i
It's at last count.,i
that's probably true.,i
There could be.,i
"I mean, when we last looked at it, yes, that would be true, And I recall that some 95% or more of those were vacant lots with no structures.",i
That's probably accurate.,i
"The largest number of those, The largest number of property holdings that we have, are vacant lots.",i
"And I mean I think I looked because for the public this is, you can export the report into a spreadsheet and you can.",i
"there are columns with codes in them And one of them says whether or not it has a structure on the lot, And I believe there were only several hundred in the entire inventory that had a structure at all.",i
"Yeah, there are very many, Yeah, okay.",i
"So I just wanted people to understand that, because I have seen conversations, either on social media, sometimes even in reporting, that make it sound like the city has thousands of actual homes And that is not the case.",i
There may be several hundred and they're probably in conditions similar to this one.,i
"Yes, And I believe that we have prioritized moving those into the land bank.",i
"But I also want to say that, you know, I think that's you know, I think that's a good thing, I think that's a good thing, I think that's a good thing, I think that's a good thing.",i
"And I also want to put some other numbers in perspective, because, Director Gula, we had a post agenda- it might've been more than 12 months ago- where we were presenting on the just volume of transactions- because that's kind of spoken to a little bit here- reviewing how lengthy of a time there is for quiet title under the Treasurer's Sales Act.",i
"This is which is, it's all required by state law.",i
"by the way, the kinds of things that you were just describing, Yep, And the numbers I have in front of me are slightly different than, I think, that reports that you generate, because we- I pulled numbers from our city council legislation, like we have, as you point out, later on today's agenda- there's dozens of properties And so we counted up the properties going back in years And, you know, before the land bank was up and running.",i
"but even Treasurer's sale properties- I mean, you know, going back to 2019, properties like this in 2019 there were only some 24 that were moved through Treasurer's sale And a total, if you put together, transferred to the URA, either sold at side yard, sold to Treasurer's sale or other means.",i
I mean it was something like 80 or 90 properties in 2019.,i
"It was even lower during the first years of COVID, 2020 and 2021, but that's understandable.",i
"But then when you got to be the director of finance, that volume really ramped up And the last complete year I have was 2023 and you moved some 250 properties And I don't have the numbers for 2024.",i
Do you know generally how much it was?,i
I think I counted half of 2024.,i
I was already up to 130 or so.,i
"Yeah, we exceeded 2023, but I'm going to- I'm going to add something there that so, due to COVID and the courts being closed and us not being able to quiet title, we had a ton of sales that were sitting not being able to do anything.",i
So there was a backlog.,i
"So once we moved into 2020, let's say two and three, we were processing sales that had started either slightly prior or during COVID that we could not complete, But last year we were kind of through that backlog And those were, those were sales that were specifically generated by my department.",i
"So there's a bit of a difference, you know, with 2023 or 2022.",i
So that's a big number.,i
"We exceeded that number, Yeah.",i
"And then you also kind of put in front of us- my numbers are a little bit out of date because I, you know, one of the advantages of being remote in council is that I can have my computer up in front of me and see that.",i
So that's a big part of that.,i
"And then the other thing that I would say that you were talking something about sales in dollars, you know, closing in on a million dollars.",i
So that's probably the biggest teller right there of the whole story.,i
"So prior to now, not so distant past, that trust fund was underwater And the city was able to fund at least three quarters of a million dollars every single year just to pay for the budget for the three TB, which almost just relates to, like, staff and court costs.",i
There was no extra and without that money that trust fund would have been in the negative and that there were no sales.,i
"in order to keep it going, We had to fund it, And so we were So like- I'm gonna interrupt you for a second.",i
I'm going to say that slightly differently.,i
The city literally lost.,i
"you know, the trust fund lost money on every property that moved.",i
"yep, got it.",i
"so since covid and the number of sales that we have put during covid, the city was like: the general fund is blah and we're not giving you money anymore for 3tb.",i
"they couldn't, so we had to sort of sink or swim on our own and we swam, and so now the balance in that trust fund is now over a million dollars.",i
"i'm going to give you a little credit here and i'm also going to say this, but i think it's factually correct: before you were the director of finance, the city was losing property money on every property it moves and the, the trust fund was in the negative.",i
"yes, and since you've been director of finance, as you said, you swam and you did not think.",i
"and now we are making money on the properties and there is about- i mean again, my numbers are a little dated, but there was about a million dollars in the trust fund.",i
"yes, there's over a million dollars in the trust fund.",i
"well, congratulations, dr gula.",i
"i just wanted to make sure because you were really great at helping us understand information at the table, but i didn't want that message to get lost, because i really really give you credit for it and i appreciate it.",i
"and you know, i'm going to go ahead and i'm going to go ahead and i'm going to go ahead.",i
"and you know, i've been saying, you know, i spent, had to spend 10 years wishing that things would get moving, that the land bank would get fixed.",i
"i, you know, as my colleagues recall, i i passed that legislation to create it in 2014 and it didn't move a single property.",i
"and so you know, not only has the land bank gotten fixed right, and so when we talk about, like over the last couple of years- and i think it's important to note that the land bank has moved properties- maybe more by now, right after- i'm a little behind on those counts- but you also, in addition, are moving hundreds, you know, or at least many dozens more.",i
i don't have exactly did i cut out?,i
"i think i cut out there, sorry.",i
"in addition to the land bank sales, you are also moving properties, as the director of finance, directly to people buying them, and so that's really important information to keep in mind, and i so i don't want to say that.",i
"do you know again, i, i there's- there's not that many of those hundreds that have been moved that have structures on them.",i
"so if we only own, you know, a couple of hundred out of 10 000 that have structures, i suspect there's only a handful, like fewer than 10, maybe fewer than five, that move, that have structures on them.",i
"or or can you, can you speak to that with?",i
"i mean, without having exactly all the numbers in front of me, i would hate to like throw something out there, but i would say that most of the property is vacant land and not structures.",i
"so those are, you know, pricing structures is kind of few and far between.",i
"okay, i think that's just helpful to know because, yes, you know, maybe we want to take a closer look.",i
i think it is some of the things that we're seeing in the industry.,i
"so, yeah, i think that's a really good point and i i think that's really important for people to understand that there's, you know, a sales agreement, just like when you're buying a house.",i
you know there's some conditions that let you kind of back out of the deal.,i
"but you have to always read the fine print really carefully in any contract, and i'm i'm open to the discussion here, but i just wanted to put some of that in context as to like the level of of success that you've had and to put into context, i think, quite small, thank you, that's what i'm sure.",i
"thank you, thank you.",i
"we have councilwoman kayla smith, followed by councilman wilson and the things that you've done over the years.",i
you've been really great to work with him and you do keep the city's interest.,i
"you know, front and foremost, but i- but i will say we're not.",i
"the city's budget is not great, so, but you're responsible for you're doing good, so thank you.",i
"but honestly, what i really want to know is more- and you were the assistant director too for a long time, so you've been involved in all this process for a long time- but do we have a legal opinion on this at all?",i
"because i'm wondering- there's some- you know, chatter, i'm hearing back and forth and i just want to make sure we're doing what's right here.",i
do you have a legal opinion on this?,i
that's saying that this is okay.,i
so i think that's a great question.,i
"so, yeah, i'm just, i'm just Okay to move this this way Or to do this, Or what happens if I hold for a legal opinion.",i
So I don't think we have a legal opinion on this Right now.,i
what the administration would like to see is striking of the language.,i
"that includes a refund of hand money, which would be precedent setting.",i
So we don't have a legal opinion.,i
"We are hopeful that there is an amendment made either in writing or a voice amendment, to strike that language.",i
that then would clear up any legal concern.,i
"So I'm sorry, Do you mind, Madam Chair?",i
